잡채,http://blog.naver.com/PostView.nhn?blogId=n2p00&logNo=221254535968,"다 해먹는 요리 학교 오늘 뭐 먹지?다해요, 장어잡채오늘 배울 요리는 집밥 : 주재료 장어잔칫상, 술상, 밥상 등등 어디든 곁들여도 좋은 요리재료양념 장어 1마리 ,우엉 150g, 양파 100g , 홍고추 2개 , 청고추 2개 , 당근 1/3개 ,부추 한줌 , 표고버섯 3~4개, 통마늘,생강,깻잎,통깨, 우엉 담구기 : 물(잠길정도) ,식초 1큰술만능간장 소스 : 진간장 3스푼, 맛술  반 스푼, 설탕 2스푼, 청주 반 스푼, 물엿 1 스푼, 물 3스푼*양념 된 장어는 마트에서 구입!*우엉은 김밥 우엉이랑 같다고 하니 만들기 싫으면 그걸 사도 될 듯 ㅋㅋ*재료는 모두 각각 따로 볶아야 맛도 모양도 예쁨!간략순서-  재료모두 채썰고▶우엉조리는 사이 ▶ 야채 볶아두고  ▶ 다 조린 우엉 덜어놓고 ▶ 이 양념에 버섯 볶고 ▶여기에 장어 +  우엉투입 ▶  그다음 ▶ 볶은 야채 투입 ▶불끄고 부추+깻잎▶참기름.깨모든 재료 가늘고 길게 채썰기!물에 식초1 큰술 넣고 채썬 우엉을 담가 둔다.(5~6cm길이)*갈변 방지를 위해 당근도 비슷 하게 채썰고,마늘은 세로(긴 방향 )로 채썬다.생강도 채~*마늘은 짧은 쪽으로 썰면 부서진다고!홍&청고추는 반 갈라 씨 제거후 길게 채썬다.준비된 야채는 대충 이만큼..~~* 재료에 대한 정확한 레시피가 없네요 ㅠㅠ감으로 요리해야 될 듯요 ㅋㅋ양념 장어도 길게 썬다. 진간장 3스푼,설탕 2스푼,맛술 반 스푼, 청주 반 스푼,물엿 한 스푼,물 3스푼 넣고~*황금 비율 간장 3: 설탕 2*물= 간장과 동량양념이  끓어 오를때  우엉을 넣어 섞은 후~~*김밥 속 우엉과 똑 같음유산지에 구멍을 뚫어 덮어 둔다.약불로 조리면 된다.양념이 자작하게 남았을때 우엉만 건져 둔다.....우엉 조린 양념장에 표고버섯을 넣어 볶아 낸다.다른 팬에 식용유,참기름  (5:1비율) 넣고 채썬 생강, 마늘,양파 볶아 덜어 둔다.*채소들의 향이 팬에 배어들어 잡내를 제거당근, 홍고추,청고추 순으로 각각 살짝 볶아  그릇에 담아 둠냄비에  표고+우엉+장어 먼저 넣어 볶다가~볶아 둔 야채를 넣어 볶고~불을 끈 후 부추 , 깻잎을 넣어 섞어 준다.마지막으로 참기름 살짝 넣어주면 완성그릇에 담은 후 깨 뿌려 완성 다해요 잡채   #다해요 장어우엉잡채"
잡채,http://blog.naver.com/PostView.nhn?blogId=moo4114&logNo=221253842654," 밑반찬에 빠지지 않는 어묵요리인 간장어묵 잡채는가늘게 채 썰어 볶아주면 잡채처럼 호로록 먹을 수 있는 밑반찬으로 좋은 어묵잡채^^ 누구나 좋아하는 초간단 밑반찬 어묵요리이지요 간장 어묵잡채 만들어놓으면 아이들 반찬으로도 아주 좋고 말고요 어묵간장볶볶음은 사각어묵을  길게 채 썰어 잡채처럼 해놓으면 우리 남편도 좋아하지만초딩 입맛인 저도 무직막지 좋아 하거든요' 해서~울 집 오늘의 밑반찬으로 어묵요리인 간장어묵볶음을 야채 듬뿍 넣어 만들어  식탁에 올려보았네요초간단 단짠 밑반찬으로 어묵요리인 간장어묵볶음,어묵잡채 만드는법 재료는사각어묵5장,양파반개,떡볶이떡10개,대파한줄,(당근적당껏)식용유&들기름(1)올리고당(3)진간장(2)참기름.깨소금.후춧가루.연두(0.5)준비 해보았어요!!초간단 단짠 밑반찬으로 좋은 간장 어묵잡채 만드는법주재료인 어묵과 당근,양파,채썰어 주면서 대파는어슷썰기 해주고 떡볶이 떡은 끓는물에소금을 넣어 삶아주었어요(간배이게)달군 팬에 식용유&들기름(1) 두르고 썰어놓은 양파 대파의 일부와 다진마늘 넣어주고살살 볶아서 야채의 향을 내주면서 양파가 숨이 죽을 때까지 볶아주었어요중불에서 채 썬 어묵과 떡볶이 떡 넣어  볶아주다가남겨놓았던 야채도 함께 볶아 주면서진간장. 올리고당 연두 에센스  넣어서 간이배이게 어우러지도록 재빨리 볶아내주네요 참기름, 깨소금, 후추로 마무리하면 초간단 단짠맛~ 밑반찬으로 좋은 어묵요리인 간장 어묵잡채 만드는법 마무리가 되가지요!어묵요리인 간장 어묵잡채 만드는법은 중간불에서 해주는 게 제일 좋으니 참고하세요!단짠맛 ~~ 단짠맛~간장어묵 잡채 만드는법~~ 끝 초간단으로 만들어낸 밑반찬 어묵잡채 아이들 어른들 누구나 좋아하는 삼대 밑반찬인 어묵요리~ 식탁에 올려 봅니다간장어묵볶음에 냉동실에 있는 떡볶이 떡 몇 개 넣어주니 더 든든한 밑반찬 어묵잡채가 만들어졌다는 사실ㅋㅋㅋ단짠~단짠맛에 젓가락이 쉴 새 없이 오가는 밑반찬!!!어묵잡채 만드는법 어떻세요!!단짠 어묵요리!!야채 듬뿍 넣은 어묵요리인 어묵잡채만들어 두고 한 이틀 먹을까 했는데 ㅋㅋ내 착각 남편님 밥도둑 납시었는지 밥 한 그릇 홀딱 비우면서 다 먹어 지웠다는!!ㅋㅋ어묵요리에 떡 몇 개 넣어주니 든든하기도 한 어묵간장볶음 ᆢ하나도 남지 않았다는 사실은 안 비밀ᆢ밑반찬이 필요하시다면단짠 어묵요리!!어묵잡채 만드는법 어떻세요!!ㅋ ㅋ어묵요리 어묵잡채 초간단 단짠 밑반찬으로 좋거든요해보시길 바래요한 주 시작하는 월요일 ᆢ벌써 꽃 피는 사월도 중반 ㅋㅋ이제는 추위 다 물러가는 듯 해요좋은 날 꽃구경 마음껏 할 수 있는 좋은 날만 남았네요ㅋㅋ모두들 행복한 한주 되시고 건강하길 바래요"
잡채,http://blog.naver.com/PostView.nhn?blogId=jmy3914&logNo=221237598166,"잡채 좋아하는 아이들 자주 해주기는 손이 많이 가는 음식이다 보니 사실 잘 안되는것 같아요그리고 만들땐 맛있게 먹고 돌아서면 당면에 팅팅 불어터져 있기도 하고 그러다 보니 다음날 남은 잡채들은 모두 버리게 되고 아깝단 생각에 늘 조금씩 하는데 그럼 모자라고 이래저래 식당에서 잡채가 나오면 어쩜 면발이 그리 탱글탱글 한지 비법 전수받고집에 와서 만들어 보는거죠첫 번째 #잡채레시피 저는 가장먼저 잡채를 할때 소고기 밑간부터 해놓는 편이예요소금약간, 후춧가루 살짝 다진마늘, 참기름 넣고 조물조물 밑간을 해 놓습니다(굴소스, 소고기양념장을 대처해도 맛있어요)두 번째 목이버섯 요건 금방 불리는 방법은 따뜻한 물을 이용하는 편이예요물에 잠길 정도로 불려서 사용을 합니다목이버섯도 아이들만 먹을땐 전 한번 볶아서 사용하고 있어요가장먼저 삶고 데치는 재료들 부터 손질을 해놓음 훨씬 편해서 저는 데치고 삶고 양념장 만들어 놓는 순서로 만들곤 합니다시금치는 보통 시금치나물 하듯 양념을 해놓기#당면불지않게만드는법 여기서 다음날 먹어도 당면이 불어 터지느냐 마느냐 우선 끓는 물에 당면 1봉지 넣습니다 (12분짜리 1봉) 당면 봉지에 보면 6분내외 라고 하는데 저는 워낙 찔깃 한것도싫어하는 편이기도 하고 저희집에서는 6분으로 조리를 하면 딱딱해져서 못먹겠지 싶어보통 10분에서 가스 불 조절에 따라 12분까지 삶는게 적당하지 싶어요파르르 끓을때 종이컵을 이용해 찬물 3번 우리 국수 삶을때 처럼 파르르 끓으면 넣는 식으로 넣으면 될것 같고요 올리브오일 이나 식용류 밥수저로 3스푼 정도 넣어서 삶아주기야채를 볶아줄땐 색이 연한색 부터 볶아놓을게요다른 양념에 색이 묻어나는게 싫어서끓는물에 살딱 데처진 버섯 다음에 양파 팬에 기름을 두르고 볶아주기양념 해놨던 고기볶고 고기볶은 기름에 파프리카 당근 볶아주기이렇게 #잡채황금레시피 맛을 내줄 재료들이죠잡채가 서로 양념들이 잘 어울어지지 않음 어떤건 싱겁고 어떤건 짜기 때문에양념을 미리 해서 어느정도 배합을 해놓는게 나중에 먹어도 서로 양념이 어울어 지는것 같아요삶아서 불려진 당면 그리고 올리고당 2개, 간장 4개, 식용류 3개 넣고 볶아주었습니다다른 재료들도 양념이 배어있기 때문에 조리 하시면서 간은 맞춰 주는게 좋을듯 합니다설탕대신 물엿을 넣었어요식당 하시는 분들도 윤기나 당면이 탱글탱글한 맛때문에 물엿 또 올리고당 설탕대신 사용 하시더라고요마무리 단계죠양념이 버무려진 재료들과 당면이 합체 여기서 약한불을 이용해 재료들이 으스러 지는걸 막기 위해 전 손으로 버무려 주는 편인데뜨겁죠 ~~ ㅋㅋㅋ 크 볶음용 집개를 이용해서 잘 버무려 주기잘 버무려진 잡채 위에 깨소금 살살살 뿌려 주면 맛있는 #잡채 #황금레시피 완성물론 저희집 입맛에 맞는 레시피긴 하지만 ^^삶을때 물을 넣어주는 것도 중요하고설탕대신 올리고당 을 넣는 것도 때깔이라 하죠 ㅋ 윤기 나는 잡채를 만드는데 중요하고워낙 식당에서 요리하시는 분들은 전문가 분들이니 알려주시는 레시피에 살짝 저희집 입맛에 맞게 바꾸 것도 있지만대략 비슷비슷 하게 맛나게 드실수 있어요당면 삶는것도 6분에서 저흰 11분 초 반에 6분 봉지에 있는 것처럼 그리고 8분 9분 다 해봤는데 11분에서 12분이때가 잡재당면이 가장 맛있게 삶아 졌어요 저희 입맛에 맞게#집들이음식 #생일상차림 #특별한날음식 등 잡채는 잔치상에 빠지지 않는 것중 하나죠그러다 보니 조금더 맛있고 쉽게 할수 있는 방법들이 있음 좋겠다 싶은데 어른들 보면 조물딱 거리면서어찌나 빠르게 잘 하시는 지... 줄줄줄 저희도 생일이 기다리고 있는데요 #잡채황금레시피 활용해 맛나게 상차림 하면 될것 같아여#잡채당면불지않게만드는법#잡채당면삶는시간#잡채만드는법 "
잡채,http://blog.naver.com/PostView.nhn?blogId=ki765331&logNo=221247980461,초블리맘 입니다:)잇님들 즐거운 일요일 보내고 계시나요 ?초블리네는 오늘 오랜만에 미세먼지도 없고날씨가 좋아서 창문 활짝열고 대청소도 하고집에서 딩굴딩굴 아주 편히 쉬는중이에요.하지만 주부는 내가 쉬어도 쉬는게 아니야.....주말이면 삼시세끼 해먹는것도보통일이 아니죠ㅜ.ㅜ요리를 좋아하는 저에게도 힘든일 !오늘은 냉장고 청소도 할겸 모든 식재료를다 꺼내서 냉장고 털기에 도전하였습니당 :)많은 야채들을 이용한 김밥과 잡채 !일명 짝퉁 교리김밥 !먼저 우리 초블리가 좋아하는 잡채만들기 준비고기가 없어 고기는 패쓰했어요 ...피망. 당근. 양파. 표고버섯. 계란지단냉장고에 있는 재료들 몽땅 준비합니다:)레시피도 내맘대로 양념도 손가는대로 그리고 재료들은 최대한 잘게잘게초블리가 먹기좋게 썰어 완성 !참기름 듬뿍 넣고 만들었더니 고소한 냄새가 진동해요 :)  맛있는 초블리네 잡채는 늘 성공 !경주짝퉁 교리김밥 만들기 준비다들 경주에서 유명한 교리김밥 아시죠?계란지단이 듬뿍들어있는 계란김밥 !제가 참 좋아하는데 오늘은 일명 초블리맘표짝퉁 교리김밥 만들기 도전 !결과는 ?먼저 없는 재료지만 가지런히햄넣고 계란듬뿍 당근도 듬뿍데친 부추도 넣고 돌돌 말아줍니다:)다행히 김밥 옆구리가 터지지 않았어요 !이렇게 완성된 짝퉁 교리김밥 !오늘 만든 김밥은 짝퉁 교리김밥과 청양고추를통째로 넣어 만든 청양고추 김밥두가지를 만들었어요.김밥의 참맛은 꽁다리제가 젤 좋아하는 김밥 꽁다리 ♡완성된 짝퉁 교리김밥과 잡채한상 !우리집 인기메뉴 잡채는 순식간에 사라졌어요.오늘의 결과물은 ?모양도 맛도 실패 ㅎㅎㅎㅎ전 옛날부터  김밥을 참 이쁘게 말지못해요..누가 비법 좀 알려주세욤 ...ㅎㅎㅎ비록 실패된 김밥이지만 울남편 맛있다며엄청 잘 먹어주었어요 ! 흐흐이렇게 오늘 저녁은 냉장고털기로 끝 !요건 우리초블리를 위해만든 대왕김밥 :)비록 모양은 이쁘지 않지만  맛있게 먹어줘서 고마워 초블리야 ♡일요일 온집을 엉망으로 파괴하는 꼬꼬마 초블리는병아리콩과 백태콩으로 소꿉놀이하며열심히 집안을 쑥대밭으로 만들었습니다....쑥대밭이면 어쩌리 잘먹고 잘놀아줘서오늘도 고맙다 ! 내딸 ♡ #주말먹방 #경주교리김밥 #따라하기 #실패#냉장고털기 #잡채 #성공 
잡채,http://blog.naver.com/PostView.nhn?blogId=angus0511&logNo=221285145805,"◁ 요구사항※ 주어진 재료를 사용하여 양장피 잡채를 만드시오. 가. 양장피는 4㎝ 정도로 하시오. 나. 고기와 채소는 5㎝ 정도 길이의 채를 써시오. 다. 겨자는 숙성시켜 사용하시오. 라. 볶은 재료와 볶지 않는 재료의 분별에 유의하여 담아내시오.◁ 수험자 유의사항1) 접시에 담아 낼 때 모양에 유의하여야 한다.2) 볶음 재료와 볶지 않는 재료의 분별에 유의하여야 한다.◁ 지급재료양장피1/2장, 돼지등심 50g, 양파 1/2개, 조선부추 30g, 건목이버섯 3개, 당근30g, 달걀1개, 진간장 5ml, 참기름 5ml, 겨자10g, 식초 50ml, 백설탕 30g, 육수 30ml, 식용유 20ml, 새우살 50g, 갑오징어살50g, 건해삼 60g, 소금 3g◁ 레시피1) 겨자를 숙성시켜 사용하기 위해 먼저 물을올려 40도정도로 따뜻해지면물1T + 겨자 1T넣어 잘 갠후 그릇 안쪽에 고루펴서 냄비두껑에 그릇을 엎어 발효시키다.2) 양장피, 건목이버섯은 미지근한 물에 불리고3) 재료를 순서대로 손질한다. - 오징어는 껍질 저거 후 안쪽에 길이로 칼집을 넣어 끓는물에 데쳐 5cm 길이로 썰고,- 새우는 머리, 내장 제거하고 끓는물에 데쳐 껍질을 제거,- 해삼은 5cm 썰어 끓는 물에 데친 후 찬물에 헹구어 식초1t에 버무려 놓았다 헹구어놓고ㅡ- 당근은 0.2cm 두께, 5cm길이로 채썰고- 오이는 돌려깍기 한 후 5cm 썰고- 달걀은 황백으로 나누어 지단을 부쳐 5cm길이로 채 썬다.- 양파는 채 썰고, 부추는 5cm길이로 썰고- 불린 목이는 알맞은 크기로 채썰고, 돼지고기는 핏물제거 후 5cm로 썰어 준비한다.4) 양장피를 끓는물에 삶아 찬물에 헹군 후 사방4cm 크기로 손으로 뜯어 간장, 참기름으로 양념한다.5) 팬에 기름을 두르고 돼지고기를 넣어 볶다가 간장1t를 넣어 양파 목이, 부추 순으로 볶은후,소금, 참기름을 넣어 맛을 낸다.6) 겨자소스는 발효시킨것에 설탕 1T, 식초 1T, 물1/2T, 소금1/2t, 참기름을 넣어 겨자가 고루 풀어지도록 잘 섞어주고7) 접시에 재료들을 각각 마주보게 담고 그 위에 양장피를 담고 , 가운데에 부추, 양파 볶은것을 올려 겨자소스를 곁들여 낸다.◁ 민이네의 합격팁!!1) 재료의 색이 겹치지않게 담으세요~~~2) 양장피가 시험에 나온다면 제출까지 시간이 촉박하니...손에 잡히는데로 재료손질하시는게최고의 합격팁이겠지요~!!ㅎㅎ"
잡채,http://blog.naver.com/PostView.nhn?blogId=lucky_hyun7&logNo=221255465728,"안녕하세요.오늘은 잡채만들기를 해보려고해요.!엄마가 아주 손맛이 끝내주는 전라도분이신데 음식도 엄청나게 잘하시고, 음식도 엄청나게 많이 한답니다..손쉬운 방법일테니 따라와보세요.!1. 시금치 손질하기 잡채에서 가장 많이 들어가는 채소중에 하나인 시금치에요.시금치를 손질해주는데 저렇게 뿌리부분에 + 이렇게 십자 모양으로 썰어주세요.! 시금치를 이렇게 넣어서 한소끔 데쳐내면 됩니다.시금치를 넣고 한참 방치를 해놓으면 시금치가 시들해지니까한번 뒤집어서 슬쩍 넣어서 빼면은 충분하답니다.!2. 시금치를 무쳐줍니다. 시금치 무침을해서 넣어도 된다고 하더라구요.시금치 무침은 마늘, 소금, 참개름, 참깨를 이용하여서 무쳐주면 됩니다.만약에 제삿상에 올라간다고 하면은 마늘을 빼주면 되겠죠?3. 당근 손질하기 당근은 어슷썰기를 먼저 한 뒤에 채썰어주면 됩니다. 기름을 두른 팬에 볶아줍니다.!그래서 볶은 것은 잡채를 버무릴 큰 볼에 넣어주면 됩니다.저 큰 볼이 싱크대 양쪽에 걸쳐지는걸 보면은 ...굉장히 크다는 것을 가능하시겠죠.엄마의 최애 믹싱볼이에요.4. 양파 손질하기 양파는 두툼하게 채썰듯이 썰어서 볶아주면 됩니다.볶아줄 때 소금을 한꼬집 조금씩 넣어도 된답니다. 5. 건표고 손질하기 건표고버섯을 넣어도 되고 아니면 목이버섯을 넣어도 된답니다.저희는 건표고가 있어서 건표고를 넣었어요.그냥.. 뭐 팽이버섯만아니라면은 넣어도되요.!6. 잡채용 돼지고기 볶기동네에서 샀는데 한돈이라고 해요.돼지고기 볶을 때 들러붙으면 물을 조금 넣어서 볶아주세요.기름을 넣으면 좀 맛이 덜해지는 것 같아요.7. 당면 삶기 당면을 삶아주세요.당면은 좀 중간에 먹어보는 것이 좋아요.그러면 익는 정도를 보고 건져내면 된답니다.8. 버무리기 이렇게 한번 불위에서 볶은 것 들은 한김식어주는 것이 좋아요. 그리고 여기에 시금치는 안됩니다! 시금치는 나중에 넣어주어야해요.설탕, 간장을 넣고 우선 버무려 줍니다.참기름은 마지막에 넣어주세요. 이렇게 김이나는데 시금치가 들어가게되면은 시금치가 노래진다고 해요.그러니까 시금치는 가장 마지막에 조금 한김 식은 후에 넣어주세요. 그리고 참기름과 깨소금을 넣어주시구요.간장으로만 간을 하게되면은 잡채가 꺼뭇해지기 때문에 간을 더 하시겠다면은 소금으로 해주시는게 좋아요.!제가 계량을 정확하게 못한 이유는 저 당면을 30인분 1봉지 하고도 반봉지가량을 더 써서 약 저희는 40인분이라고 하지만... 저희엄마는 단촐한 저희식구먹을거라고하다보니 .. 엄마의 손이 계량기였어요.그리고 간은 넣어가면서 해보시는게 가장 좋아요. 또 맛있는 요리로 돌아올게요! "
잡채,http://blog.naver.com/PostView.nhn?blogId=kea1987&logNo=221262687237,"생신상 차리기 - 잡채 만들기그동안 결혼하고 이것저것 하다보니 바빠서 계속 블로그 활동을 못했네요 ㅠ 마지막 포스팅한지도 1년이 넘다니....이제 열심히 해야겠어요 ㅋ몇일전 시부모님 생신이어서 처음으로 생신상을 차렸어요 그중에서도 가장 기본이 된다는 잡채 만들기 도전!! 생신상 차리려고 재료 산거라서 재료가 이것저것 많네요 저 많은 재료 중에 잡채 만들기에 필요한 재료는 뭘까요? ㅎㅎ식재료 -당면, 표고버섯, 양파 ; 당근, 파프리카, 느타리버섯, 목이버섯, 시금치 , 잡채용고기, 참기름, 간장, 설탕 , 통깨 쨘~!! 잡채 만들때 필요한 재료를 먹기좋게 다듬어주세요 제가 버섯을 좋아해서 버섯 종류가 많은데 잡채에 들어가는 야채는 기호에 맞게 넣어주세요 잡채용 고기는 밑간을 해야 더 맛있어요 야채는 양파-당근-버섯 등 딱딱한 재료 먼저 볶아요 시금치는 뜨거운물에 잠깐 데쳐서 참기름으로 조물조물 볶으니까 수분이 빠져서 뭔가 양이 작아진 느낌?? 이렇게 모아놓으니까 예쁘네요 여기다 찬밥이랑 고추장만 넣어서 비빔밥 해먹어도 맛있을거같아요 ㅋ당면은 물에 뿔려야해요 저는 뜨거운물에 삶았어요 뜨거운물에 삶아서  간장이랑 참기름으로 양념해주세요  당면이 길어서 싫은 분들은 가위로 몇번 자르면 먹기 편해요 야채랑 면이랑 다같이 넣고 섞어주세요 중간중간 간 보면서 간장이랑 참기름 더 넣어주면 훨씬 맛있답니다 음식은 역시 손맛이쥬 잡채완성~~!!! 생신상에 차리려고 몇가지 더 해봤어요 나머지 음식은 다음 포스팅에서 공개할게요^^"
잡채,http://blog.naver.com/PostView.nhn?blogId=nara6965&logNo=221270167632,얼마전 짝궁생일이어서  미역국 끼리고잡채도 같이 했드랬죠이나이 되도록 잡채는 처음 만들어보네요 ㅋ잡채도 안좋아하고 어려운 음식이라고 생각했었거든요근데  간단하면서  맛도있고  ㅋ옛날당면 사용했구요 총 300g 중  170g정도 사용했어요잡채당면삶기)당면은 물에 불리지않고 9분 센불에서 삶젓가락으로  뒤적뒤적하면서 ㅋ찬물에 여러번 헹궈서채반에 물기를 먼저 빼줬어요그담계란한개를 노른자 ㆍ흰자 따라 굽어서얇게 썰어서 지단만들었어요노른자는 생각보다 양이 적고  걸쭉해요고래서..우유 약간 섞어서 구우니 딱 좋네요!!원래 우유들어가면 더 부드럽자나용~야채시금치는 살짝데쳐서 맛소금ㆍ참기름잡채용고기 맛소금ㆍ후추넣고 볶음버섯ㆍ양파ㆍ채썬당근  기름 살짝두르고  볶음(따로 간하지않음)잡채소스 만들기궁중팬에 간장1/3 컵ㆍ 올리고당 1/3 (종이컵)식용유 5스푼  ㆍ마늘 0.5 스푼숟가락으로  휘리릭~~아까  물기뺀 잡채를 붓고 5분 달달볶첨하는거라 ..걱정반  기대반 ^^;;맛을 보니 딱 좋은거에요 ㅎㅎ실패하면 수습불가  ㅋ야채ㆍ고기넣고  볶는다들기름 ㆍ깨소금  마무리한다잡채들기 어렵지않네요 ㅎㅎ잡채만들기 마무리)지단올리고 사진찍는다 ㅎ짝궁한테 맛있다고 칭찬받았어요   헷동생도 맛있다고 함 ㅋ 맛없음? 먹을만하다고!!   잡채 냉동보관)많이  먹었는데도   요렇게나 남았어요그냥두면 더  퍼질거같아서  일단 냉동보관하나는  저녁에 동생와서 주고 나머진며칠잇다  먹어치웠어요  ㅋ냉동잡채 해동할때는 먼저 전자렌지 돌려서 허물하게 만들어주세요팬에  뜨거운물 붓고 들기름 살짝칠해서  먹으니 괜찮네요감쪽같음  ㅋ 다먹은뒤 또 있냐고  물어봤음 ㅋ ㅋ또 먹고싶어서 물어본걸로~ !잡채는 한번 할때 많이들 하시니까..소분해서 냉동실에 넣어두면 반찬없을때  ㅋ잡채밥으로도 먹을수 있고 좋은거같아여대신 최대한 빨리 드시는게 좋겟조? 
잡채,http://blog.naver.com/PostView.nhn?blogId=light_3612&logNo=221290610011,
