잡채,http://blog.naver.com/PostView.nhn?blogId=jiyeun223&logNo=221290230619,"안녕하세요. 랑이입니당.오늘은 쉽지만 정성 담긴 한식요리만드는 법에 대해 포스팅 해보려고 합니당남녀노소 열광하는단짠 대표 요리이자한식 대표 요리손이 많이 가는 듯 하지만차근히 보면 참 쉬운잔치상이나 명절음식 집들이음식 등활용도가 높으니잇님들도 함께 레시피 저장♡Rang.ee's🍦Recipe(컵 : 종이컵 T : 밥수저 t : 티스푼)당면 500g시금치 한단양파 1개당근 반개목이버섯 5개표고버섯 5개잡채용돼지고기 400g시금치 국간장1T(or 소금1/2t) 참기름1/2T 깨소금약간당근,양파,목이버섯 각각 소금2꼬집 식용유약간표고버섯+돼지고기간장3T,다진마늘1T,후추톡톡,맛술1T,참기름1T당면 간장2/3컵,설탕2/3컵,식용유1/2컵전체마무리 참기름1T,깨소금약간시금치는 뿌리 부분과 지저분한 잎들을 제거하고  깨끗이 씻어요.시금치 데치기1 물에 굵은 소금 한스푼을 넣고 팔팔 끓여요2 불을 끄고 뜨거운물에 시금치를 10초정도 뒤적이며 데쳐요3 찬물에 헹군 뒤, 물기를 짜줍니다.먹기 좋게 자른 뒤 양념에 조물조물국간장1T(or 소금1/2t) 참기름1/2T 깨소금약간다른 채소들은 채 썰고목이버섯은 물에 불려서 먹기 좋게 잘라요돼지고기와 표고버섯은 함께 양념에 10분정도 재워 둡니다간장3T,다진마늘1T,후추약간,맛술1T,참기름1T당근은 기름에 색베임이 나오고고기는 고기 기름에 지저분 해지므로중간에 팬을 닦지 않고 볶기 위해양파,목이버섯,당근,고기 순으로 한 팬에 계속 볶아줘요.식용유를 한번 두르고 양파와 소금 두 꼬집을 넣고센불로숨이 죽을 때까지 볶아요식용유를 한번 두르고 목이버섯과 소금 두 꼬집을 넣고센불로목이버섯의 색이 옅어질 때까지 볶아요식용유를 한번 두르고당근과 소금 두 꼬집을 넣고센불로당근의 숨이 죽을때까지 볶아요식용유를 한번 두르고양념된 돼지고기&표고버섯을센불로고기의 색이 변할때까지 볶다가 중불에서 고기가 완전히 익을 때까지 볶아 줍니다당면은 찬물에 1시간 정도 불린 뒤 끓는물에 10분 삶아 줍니다✔불린 당면은 반정도 잘라서 삶으면 먹기 좋아요바로 찬물로 헹궈 물기를 빼줍니다삶아 둔 당면 설탕2/3컵,간장2/3컵,식용유1/2컵을순서대로팬에 넣고 센불에서 뒤적이며 자작자작하게 졸여 줍니다. ✔식용유를 넣어 주면 면이 쉽게 불지 않아요✔식용유를 먼저 넣고 졸이면 면에 코팅이 되어 간이 베어들지 않고 간장 부터 졸이면 단맛이 베어들지 않으므로 순서대로 넣거나 한꺼번에 넣습니다.볶아 놓은 재료와 졸여 놓은 당면을 한 볼에 넣고 참기름1T와 깨소금을함께 버무려 주면 완성"
잡채,http://blog.naver.com/PostView.nhn?blogId=unmix&logNo=221286016778,"안녕하세요, 레이입니다 :)요즘 날씨가 부쩍 더워졌어요. 5월 말이기에 다음 달부터 초여름 날씨가 시작된다고 해도 이상하지 않은데 날씨가 오락가락하니 더 덥게 느껴지네요.날이 후덥지근해서 그런지 저녁마다 시원한 맥주 한 캔 생각이 간절해진다는ㅎ시원한 맥주 한 잔 생각날  때 누군가 영양가 있고 맛있는 음식을 뚝딱 만들어준다면 더없이 행복할 것 같아요.오늘은 든든한 술안주, 집들이 요리, 생일상차림 등 특별하고 맛있는 요리가 생각날 때 딱 맞는 고추잡채 황금레시피 보여드릴게요.한국야쿠르트 잇츠온 프레시 밀키트소고기 고추잡채 & 꽃빵 키트2인분 ㅣ 20분 ㅣ ★★☆☆☆잇츠온 프레시 밀키트는 미리 만들어두지 않고 주문이 들어오면 그때 만들어 야쿠르트 아주머니가 정성을 담아 배송해줍니다.  제품 하나만 구입해도 무료로 배송해준다는 점.. 대박이지 않나요?인터넷에서 쇼핑을 해도 상응하는 배송비가 있고 마트에서 온라인으로 먹거리를 주문을 해도 배송비가 붙기에 이런 시스템 너무 좋아요~제품을 개봉해보았는데요 재료가 하나씩 깔끔하게 소포장 되어 있어 위생적이고, 재료에 소고기가 들어있어 아이스팩까지 넣어주셔서 신선한 상태 그대로 받을 수 있었어요.고추잡채 황금레시피를 실현할 수 있는 재료가 가득가득~ 어떤 것들이 있는지 자세히 살펴볼게요.우선 쿠킹 레시피 카드! 레시피 카드는  밀키트 제품마다 들어있는데요 요리법이 간단하면서 자세히 나와있어 초보자도 쉽게 따라 할 수 있어요.모든 재료는 준비되어 있으니 요리 시작하기 전에 꼼꼼하게 읽어보고 시작하면 더 수월합니다.특히 셰프의 Tip부분을 참고하면 보다 맛있게 만들 수 있어요.고추잡채에 들어가는 재료인데요 소고기부터 꽃빵, 소스, 고추기름, 표고버섯, 대파, 피망, 양파, 매운 고추까지 다양하게 들어있어요.요리에 맞는 재료가 정량에 맞춰 손질된 상태로 배달되기에 개봉해서 사용하기만 하면 되니 낭비도 없고 편리한데다 조리시간도 음식에 따라 6분 ~ 약 20분 사이 완성되니 이보다 더 간편할 수 없는 것 같아요.이제 잇츠온 프레시 밀키트 소고기고추잡채 & 꽃빵 키트로 고추잡채 황금레시피 시작해볼게요!소고기는 키친타월로 핏기를 제거하고 0.5 cm 너비로 채 썰어요. 여기에 오일 1 큰 술과 후추 약간 넣고 밑간해 10분간 숙성합니다.프라이팬에 오일을 두르지 않은 상태로 센불로 1분간 예열한 뒤 고추기름 ⅔ 용량을 붓고 표고버섯, 대파를 넣어 1분간 볶습니다.이때 매콤한 불향이 물씬~ 대파와 표고버섯의 향이 어우러져 시작부터 맛있는 냄새가 코를 자극해요!양파, 피망, 매운 고추를 넣고 2분간 볶은 뒤 소고기를 넣고 1분간 볶습니다.★셰프의 Tip  소고기를 너무 오래 볶으면 식감이 질겨질 수 있어요.두꺼운 프라이팬을 사용하면 채소에서 나오는 수분이 줄어듭니다.소고기가 익으면 볶음 소스를 넣고 골고루 섞으면서 30초간 조리하고 남은 고추기름을 넣어 골고루 볶아 꽃빵과 함께 플레이팅 하면 됩니다.쿠킹 레시피 카드에 나온 꽃방 데우는 방법 중 하나를 해봤는데요 정말 굿! ㅎㅎ물에 적신 키친타월로 꽃빵의 위아래를 감싼 뒤 전자레인지에 2분간 데우니 촉촉하면서 말랑말랑하게 데워지더라고요.찜통 사용하시는 분들은 스팀이 올라온 뒤 꽃빵을 넣어 5분간 찌면 됩니다.고추잡채 황금레시피! 남편이 굉장히 좋아하는 음식이어서 저는 최근에 두 번이나 만들어 먹었다죠~4월 말 제주도로 가족여행 떠나기 전에 블로그도 해야 하고 짐도 싸야 하고 친정엄마도 오셔서 신경 써야 할 게 참 많았어요. 누가 대신 밥 좀 해줬으면~ 했는데 잇츠온 제품이 있어 어찌나 다행이던지요^^ 잇츠온 프레시 밀키트, 국, 찌개 준비해 여행 가기 전 이틀 동안에 야무지게 먹고 갔답니다.제주도 다녀와서도 그 맛을 잊지 못해 또 먹게 되었는데요~ 맥주 한 캔 곁들여 맛있게 냠냠 ^ㅗ^분명히 내 손으로 만들었지만 조리시간도 짧고 재료도 준비하지 않았기에 누가 만들어준 느낌이에요. 대접받는 느낌이라죠^^말랑말랑한 꽃빵에 소고기, 표고버섯, 피망, 양파 올려 맛있게 냠냠~ 불 맛이 확 올라오면서 매콤한 것이 먹을수록 자꾸 당기네요~ 제가 만들면 왜 이 맛이 안 날까요 ㅠㅠ 남편이랑 둘이서 먹으니 딱 좋아요. 과하지 않게 든든한 것이 굿! 술안주로 맛있게 잘 먹었는데요 매운 고추를 빼고 만들면 아이들도 먹을 수 있기에 온 가족 영양 반찬, 야식으로도 준비해도 좋답니다.1인 가구, 맞벌이, 기타 개인 사정 등으로  신선 간편식, 즉석조리식품이 많이 이용하실 것 같아요. 저는 전업주부지만 체력적 한계로 아무것도 하기 싫을 때, 아플 때, 개인적인 일로 바쁠 때 신선 간편식을 찾게 되는데요 맛, 가격, 영양, 편리함 모든 걸 다 충족시켜주는 건 잇츠온 프레시 밀키트뿐인 것 같아요. 최근 다양한 제품을 접해봤는데 어느 하나 빠지는 것 없이 다 만족스러웠습니다.저처럼 신선 간편식이 필요하신 분들은 잇츠온 프레시 밀키트로 시작해보세요.잇츠온 제품 구입할 때 저렴하게 살 수 있는 팁 알려드릴게요!잇츠온 제품은 정기배송(1회도 가능)을 통해 주문하면 4만 원 이상 주문 시 10% 할인 혜택이 주어지는데요 쿠폰 프로모션 코드란에 제 아이디인 'unmix'를 넣으면10,000원 이상 구매 시 잇츠온 전제품에 사용가능한 3천 원 할인 쿠폰이 발급됩니다. (할인코드 월 3회 적용)정기배송에서 필요한 제품을 담고 배송 희망시간을 선택한 후 추천인 코드란에 아이디(unmix)를 입력하면쿠폰 발급 메시지가 나와요. 제품 목록 왼쪽에 있는 쿠폰 조회를 클릭하면사용 가능한 쿠폰이 뜬답니다. 원하는 쿠폰을 찾아 선택하면  할인 적용 끝!정기배송 서비스 이용해 10% 할인가로 이용하는 것도 좋지만 추천인 할인코드도 정말 좋네요 굿!!! 맞벌이 부부로 요즘 저 못지 않게 자주 주문하는 동생에게도 알려줘야겠어요. 이웃님들도 잇츠온 제품 이용하실 때 꼭 이용해보세요.추천인 코드 : unmix추천인 코드로 알뜰하게 구입하기 GO!"
잡채,http://blog.naver.com/PostView.nhn?blogId=ebbee0621&logNo=221275578699,"중국요리이지만아삭하고 매콤한 식감 때문인지한국인에게 더 사랑받는 고추잡채뽀얗고 폭신폭신한 꽃빵에 싸먹으면매콤하고 부드러운 맛을 동시에 느낄 수 있는 별미지요~어렵게만 느껴졌던 중식요리도이제 쉽고 간편하게 집에서 만들 수 있어요~손님 오셨을때 메인요리로도생일상에 올려도 충분히 화려한 비쥬얼과맛은 더 화려한 고추잡채 만드는 법이에요~고추잡채 만드는 법재료파프리카 빨강, 노랑 1개씩피망 초록 1개청양고추 3개잡채용 돼지고기 250g양파 1/2개파 1대새송이버섯 1대편마늘 5개고기양념간장1스푼참기름 1/2스푼다진마늘 1/2스푼고추잡채 양념굴소스 2스푼,설탕 1스푼간장 1스푼올리고당 1스푼고추기름 2스푼+ 모든 계량은 밥숟가락 기준입니다 :)01. 피망과 파프리카는 기둥과 밑둥을 자르고, 씨를 제거하고 일정한 길이로 잘라주시고,나무지 야채들도 비슷하 길이로 잘라서 손질해주세요~간마늘을 사용하면 지저분해보여 마늘 5개를편마늘로 썰어서 사용했어요 :)02. 잡채용 돼지고기를 먼저 간을 해주세요간장 1스푼, 참기름 1/2스푼, 다진마늘 1/2스푼, 후추툭툭을 넣고 조물조물 양념을 해주세요~중식요리의 꽃은 바로 궁중팬이죠!!!일명 웍이라고 불리는 깊이가 있는 팬에불맛 가득 내며 휙휙~돌려줘야또 중식요리의 제맛이 나는듯해요~(영화를 너무 많이 봤나?ㅋㅋ 저 지금 요리왕 비룡 빙의중 ㅋㅋㅋ)오늘은 해피콜 크로커다일 IH 궁중팬을사용해 맛있는 고추잡채를 만들어보려고 해요.해피콜 궁중팬은 깊이고 깊어 음식물이 튀거나 밖으로 가출할 일이 없고,넓이도 넓어 많은양의 요리를 할 수 있어두루두루 잘 사용하고 있어요 :)후라이팬 표면에 보이듯이2만여개의 오일스팟이 우물구조로 되어 있어음식재료가 눌러붙지 않고 떠 있게 해줍니다.또한 팬의 가장자리의 림(Rim) 부분이곡선으로 말려있어 국물을 흘리지 않고따를 수 있어 국물이 자작하게 있는고추잡채 요리를 하기에 제격인 팬이에요~고급진 느낌의 우드 손잡이가 한층 더 품격을 높여줘요 :)나혼자산다에 다니엘헤니가 저 손잡이를 잡는데 진짜 너무 므쪘다는 ㅋㅋㅋ그래서 요리하기 전인데 괜시리 다니엘헤니와함께 하고픈 느낌으로 잡아봤어요 ㅎㅎㅎ03. 고추기름 1스푼을 넣고 마늘5개를 편마늘로 잘라 준 뒤 볶아주세요 :)사진을 보시면 고추기름이 퍼져있는게 아니라송글송글하게 물방울처럼 맺혀 있는걸 보실 수 있으실꺼에요~바로 2만여개의 오일스팟의 효과가눈으로 바로 보여서 오오오오~하며즐거운 마음으로 요리를 시작했어요~04. 미리 양념을 해 둔 돼지고기를 넣고 핏기가 없어질때까지 볶아주세요~05. 나머지 야채들을 넣어서 숨이 약간 죽을때까지 볶아주세요~야채들은 센불에 볶아야지야채에서 불이 안나와요~센불 가즈아아아아!!! 퐈이야~~해피콜 크로커다일 IH 후라이팬세트에 있는인덕션은 원하는 온도로 조절되어 넘나 간편하고 화력이 정말 쎄네요 ㅎㅎ묵직하고 그립감 좋은우드 손잡이를 야무지게 쥐고는비룡왕 빙의되어 휙휙!!!!! 깊이감이 충분해 야채들이 밖으로나오지도 않고, 양도 많은데도 불구하고아직도 넉넉하게 공간이 남아있을 정도에요~06. 야채들의 숨이 약간 죽었을때 만들어 둔 양념을 넣고 다시 한번 휙훡~양념이 잘 스며 들 수 있도록 볶아주세요~마지막으로 간을 보고 부족한 간은추가해주세요 :)고추잡채에서 없어서는 안될절대적 존재가 바로 꽃빵 이죠!!ㅎㅎ부드럽게 돌돌 말린 새하얀 꽃빵위에매콤하고 아삭한 고추잡채를 올려입안 가득 먹어야 또 제맛이죠!!! ㅎㅎ마땅한 찜기가 없을때,해피콜 후라이팬만 있으면쉽고 빠르게 뽀송뽀송한 꽃빵도 찔 수 있어요~01. 해피콜 후라이팬에 물을 자작하게 부어 끓여주세요~02. 냉동실에 넣어뒀더니 돌덩어리처럼 단단해진 냉동꽃방을 넣어주세요~03. 후라이팬 뚜껑을 꼭 닫아주세요~꽃빵은 보통 10분 정도 쪄주는데해피콜 후라이팬으로는 5분 정도밖에 안걸렸어요 ㅎㅎㅎ중간에 물이 마르면 타지 않을까 싶어후라이팬 옆을 떠나지를 못했는데투명한 유리뚜껑으로 내부가 보여너무나 편했어요 :)04. 뚜껑을 바로 열지말고 1분간 뜸들일시간을 주세요 :)과연 꽃빵은 잘 익었을까요?아뜨!! 아뜨!!! 손에 쥐는게 힘들정도로 뜨거워진 꽃빵은한눈에 봐도 마시멜로우처럼폭신폭신한 비쥬얼이에요 :)안은 더 뜨꺼울 것 같아양손 집게 신공으로 꽃빵 속을 벗겨봤는데스르륵 결대로 벗겨질 만큼아주 잘 익었어요 :)냄새마저도 고소한 스멜~~손가락으로 눌러봐도폭신폭신, 말랑말랑~~너무 잘 쪄졌죠?ㅎㅎㅎ바닥에 눌러붙는게 전혀 없이꽃빵도, 후라이팬 바닥도 너무 깨끗해요~후라이팬으로도 이렇게 쉽고간편하게 꽃빵을 찔 수 있다니!!!!이제 잘 쓰지 않아 구석에 있는 찜기 어렵게 꺼내지 마시고 해피콜 후라이팬으로쉽고 간편하게 !!! 찜기 기능도 됩니다 ㅎㅎ꽃빵과 함께 곁들여 낸 고추잡채아시아 아시아 스러운화려한 접시에 담아냈더니중국 어디쯤 와 있는 느낌이에요~(중국은 못가봤으면서 ㅋㅋㅋ)남편이 중국여행에서 사온정체모를 중국술병까지 꺼내보니,더 중국중국 스러워졌어요 ㅎㅎ아직까지 뜨거운 김을 뿜어내는뽀얀 꽃방들과 고추잡채의 화려한 색이대비되어 더 맛스럽게 보여요~이런 고추잡채 비주얼이면손님초대요리로도 아주 손색이 없겠죠?맛은 또 얼마나 맛있겠요?청양고추 3개를 더 넣었더니훨씬 깔끔하고 매콤한 맛이 더 식욕을 자극하고, 아삭아삭한 야채들의 식감이완전 맛있어요~뭐, 제가 만들어서 맛있다 하겠지만오늘은 특히 더 맛있어요 :)요즘 매콤한게 땡겨서 그런지.해피콜 덕분에 요리도 간편하게 해서더 기분좋게 먹을 수 있어요~아삭하고 향긋한 파프리카, 피망과고기의 육즙과 굴소스, 고추기름이 더해져어느 맛 하나가 튀지않고,다 잘 어울러져 더 맛있어요 :)돌돌 말린 꽃빵을 결대로 자라젓가락으로 매콤한 고추잡채를 한움큼 잡어꽃빵위에 올려 말아 입속에 우걱우걱 넣어 먹으면 매콤하고 부드러운 꽃빵의 맛을동시에 느낄 수 있어요~남편은 국물까지 싹싹 꽃빵에 찍어다 먹을 정도로 맛 하나는 기똥찹니다 :)가끔 특별한 음식이 땡낄때,고추잡채 만드는 법 해보세요 :)"
잡채,http://blog.naver.com/PostView.nhn?blogId=kami0413&logNo=221271375283,"잡채만들기 황금레시피 요거!요즘 입맛없다는 까남을 위해 준비한 요리~잡채!!! 생일상 파티상 한식 행사에서 빠질수없는 접대메뉴죠?그런데 잡채가 말입니당,,,간맞추기가 쉽지 않아요~그런데 언젠가 티비에서 어느 시장 반찬가게가 잡채가 맛나서 문전성시!황금레시피를 전수하더라구요~그래서 까여사도 한번 만들어봤습니당,,잡채만들기 황금레시피 궁금하시죠?일단 불고기감을 제어둡니다하루이틀 오래가 아니구요리 시작할때 살짝 밑간정도로 제워뒀다가 볶아주심 맛나요^^그러니 제일 먼저 시작해봅니다까여사가 준비한 고기는 설도~요즘 설도맛에 푹! 덩어리고기로 사와서 스테끼로 먹어도 볶아먹거나 이렇게 요리에 써도 굿! 이더라구요때깔 좋죠? ㅎㅎ 항시고기는 사랑입니당~간장 : 설탕 : 미림 : 참기름2 : 1 : 1 : 1고기양념 비율이에요~그리고 다진마늘 1작은술~요렇게만 하면 양념맛이 진하지 않은 불고기 양념이에요~까여사는 조금 넉넉히 양념준비 했어요,,그 이유는 아래에~^^크~~ 윤기 촤르르르르~ 요대로 달달 볶아서 먹고 싶어요 추릅!!다음은 시금치준비~시금치데치기 비법도 방출해 볼까요?^^물양을 조금만 잡는거에요~그리고! 슬적 슬적 앞뒤로 뒤집었다가 숨만 죽었다 싶음 건저셔 찬물샤워!그래야 시금치맛이 빠지지 않는데요~유관으로 보기 푹 쳐질정도로 삶아내면 나중에 곤죽이 된다는!!삶는다는느낌보다는 데친다! 가 맞답니다~참참참!! 데칠물에 소금한꼬집하면 푸르름을 유지^^찬물샤워후물기를 꼭짠시금치에소금 후추 참기름 톡톡하고 조물조물~버섯, 시금치, 파프리카, 당근알록 달록 색색별로 준비했어요~^^양파도 했어야 하는데 깜빡 ㅠㅠ잡채의 꽃!! 당면을 준비해야겠죠?2-3인분 기준으로 엄지와 검지 동그랗게 해서 꽉차게 준비하면 넉넉하더라구요~끓는물에 6분정도 삶아서 찬물샤워~후 체에 밭혀 물기를 빼주세요^^까여사의 오늘의 잡채는 볶는잡채라 당면은 완전 퍼지게 삶지 않습니다^^아까,,넉넉히 준비한 고기양념 기억하세요?고기가 어느정도 제워졌을때 준비된 버섯을 넣어 조물조물~잠깐이나마 이렇게 양념이 섞이면 더 맛나더라구요~센불에서 고기를 맛나게 익혀주고요~야채는 딱딱한 당근부터 볶다가 파프리카 넣고 볶기~생각보다 오래 볶아야 파프리가 숨이 죽어요~ 확실히 볶아야 완성후 물이 나오지 않으니 기억하세요^^요렇게 각 재료를 준비하셧음 잡채만들기 80% 준비 끝!!자 이제 잡채만들기의 황금레시피 공개해 볼까요?바로바로 당면을 양념장에 따로 볶기!!!!양념장은 간장 : 설탕 : 미림 : 참기름(2 : 1 : 1 : 1)에 파, 마늘, 후추톡톡삶은당면에 양념장을 부어가면서 볶아주세요!!!!잡채의 반은 당면맛이죠? 그러니 요렇게 당면을 따로국밥처럼 양념볶음해주면맛나겠어요? 안맛겠어요??하하하하하하  바보같은 질문이네요~항시 잡채간을 맞추기가 힘을지 않으셨나요? 분명 만들땐 짭조롬했는데...다 완성되면 어딘가 모르게 2%부족한,,,@@그래서 잡채만드리근 어렵다 했는데~요렇게 하니 완전 쉽고 맛나다능~!!!ㅎㅎㅎ윤기 촤르르르~~~면발 탱탱~!!요렇게 볶기때문에 살짝 삶았던거랍니당^^볶아진 당면에 준비된 재료넣고통깨와 참기름으로 버물버물 맛나게 버부려 주면 끝!!간 딱 맞는 잡채만들기 대령이요~~황금레시피 맛지요?입맛없는 가족들을 위해 잡채 한접시 어떠세요?^^오늘도 날씨는 화창하네요~그러나 온도변화가 심해서 감기걸린 잇님들 많으시더라구요~건강!! 맛난거 먹고 챙기시자구요^^"
잡채,http://blog.naver.com/PostView.nhn?blogId=wndaodls01&logNo=221279331707,"몇일전 친구들이 놀러왔어요놀러오기 며칠 전부터 잡채 해준다구 해준다고 ~~입방정을 아주ㅋㅋㅋㅋㅋㅋㅋㅋㅋㅋㅋㅋㅋㅋㅋㅋㅋㅋㅋㅋㅋㅋㅋㅋㅋㅋㅋㅋㅋ그래서 친구들 오기 전날에이마트에 가서 장을 봤어용원래 김밥이랑 잡채 같이 해줄려고 했는데..잡채를 만들다보니 몸에 힘이점점 빠져서 ..김밥재료는 아직두 냉장고에 ..ㅋㅋㅋㅋㅋㅋㅋㅋㅋㅋㅋㅋㅋㅋㅋㅋㅋㅋㅋㅋㅋㅋㅋㅋㅋㅋㅋㅋㅋㅋㅋㅋㅋㅋㅋㅋㅋㅋㅋㅋㅋ시금치가 ,, 아주 시금..시금.....ㅋㅋㅋㅋㅋㅋㅋㅋㅋㅋㅋㅋㅋㅋㅋㅋ거리구있네용시금치나물이라도 만들어야겠어요잡채에 필요한 재료는느타리 버섯당근(ㄲㅏ먹고 안넣음)양파잡채용 고기어묵계란시금치당면간장설탕참기름깨소금저는 먼저 계란지단을 만들었어요노른자와 흰자를 분리시키구노른자에는 우유를 조금 섞었어요왜 섞냐면요 ... 그냥 .. 이유없음 .. 내 맘 .. 식용유을 두르고 지단을 만들었어용지단 부치는거 쉬운일은 아니네요ㅋㅋㅋㅋㅋㅋㅋㅋㅋㅋㅋㅋㅋㅋㅋㅋㅋㅋㅋㅋ흰자 찢어짐 ㅠㅠㅠㅠㅠㅠㅠㅠㅠ 힝간을 위해서 맛소금은 쪼금씩 뿌려주셔야 해용얼만큼 ? 적 당 히 그담엔 버섯을 볶아줬어요버섯은 버섯자체에서 물이 나오니까따로 식용유를 두를 필요는 없습니다 ~소금간만 적당히 해주세요다 볶았으면 접시에 이뿌게 담아주시고버섯에서 물이빠져서 양이 많이줄었네용ㅋㅋㅋㅋㅋㅋㅋㅋㅋㅋㅋㅋㅋㅋㅋㅋㅋㅋㅋㅋㅋㅋㅋㅋㅋㅋㅋㅋ나 버섯 좋은뎅 ㅠ_ㅠ 잡채용 고기에도 소금간 해주고 볶아주세용ㅋㅋㅋㅋㅋㅋㅋㅋㅋㅋㅋㅋㅋㅋ어묵도 적당한 간격으로 썰어서볶아주시공 ㅎㅎㅎㅎ시금치와양파도 준비합니다ㅋㅋㅋㅋㅋㅋㅋㅋㅋㅋㅋㅋㅋ시금치는 끓는물에 소금간을 해서 잠깐 데쳐주시구양파도 소금간 살짝 ~시금치는 살짝 데치고 물기를 빼주신 다음에맛소금 조금과 참기름으로조물조물 무쳐줍니당ㅋㅋㅋㅋㅋㅋㅋㅋㅋㅋㅋㅋㅋㅋㅋ아... 이때부터 인가요 ... 내 몸에 힘이 빠지기 시작한게 ? 사진이 흔들리네요ㅋㅋㅋㅋㅋㅋㅋㅋㅋㅋㅋㅋㅋㅋㅋㅋ당면은 미리 불려서 준비해주세요 ㅎㅎㅎㅎㅎㅎㅎ저는 1시간 정도 불렸어요당면은 끓는물에 6분 정도삶아주시면 됩니당삶고난뒤엔 바로 찬물에 헹궈주셔야해용절대 고기가 다른재료에 비해서많아보인다면정답입니다의도치 않았지만 그렇게 됐네용 ㅎㅎㅎㅎㅎㅎㅎㅎㅎ사진에 안보이는 당근은.. 까먹었어요 .. 당근 많이 사놨는데 .. 냉장고에서 잠들어있어요ㅠㅠ카레만들어야겠네요재료를 큰 볼에 모두 담아주시고당면을 투척!!!!!!!!!!!!버섯이 너무 적길래 조금 더 볶았네용 ^^ㅋㅋㅋㅋㅋㅋㅋㅋㅋㅋㅋㅋㅋㅋㅋㅋㅋㅋㅋㅋ간장을 적당량을 넣고(중간중간 맛봐주세용)ㅋㅋㅋㅋㅋㅋㅋㅋㅋㅋㅋㅋㅋㅋㅋㅋㅋ설탕으로 마무리 하면 끝 !!!!잡채에 설탕을 왜 넣냐고 뭐라고 하던친구가있었는데.. 잡채엔 설탕 꼭 필요합니다(울할머니말씀)그 친구도 제 잡채먹더니 맛있따고 ~ 맛있다고 ~ (정예인)조물조물 비비고 깨소금으로 마무리 하면 끝 !ㅋㅋㅋㅋㅋㅋㅋㅋㅋㅋㅋㅋㅋㅋㅋㅋㅋㅋㅋㅋㅋㅋㅋㅋㅋㅋㅋㅋㅋㅋ아우 두번은 못하겠어요 ..나이가 들어서그런가체력이 저질 ㅠㅠ 1년에 한번만 하는걸루.. 그나저나 냉장고에 있는 김밥재료언제 만들죠 ... ㅎㅎㅎㅎㅎㅎㅎㅎㅎㅎㅎㅎㅎㅎㅎ당근이없어서 잡채가 이뿌진 않지만맛은 보장합니당 ~~~~ JMT ~재료를 다 채썰어야한다는게 흠이지만 그래두 나름 간단한잡채 !아 .. 쓰다보니 배고푸다 그럼 야매 집밥 알선생 잡채포스팅 마무리할게용 ㅎㅎ "
