잡채,http://blog.naver.com/PostView.nhn?blogId=kokopelli08&logNo=221297232436,"﻿6월 제철감자요리 감자잡채 레시피​​​​​당면대신 6월 제철감자를 사용아삭한 식감에 감자잡채 맛있게 먹을 수 있답니다.​사실 잡채용 소고기를 넣어야 하는데 소고기가 없어소고기 대신 아이들이 좋아하는 ​베이컨을 이용했는데 간도 더 잘 맞고 아이들 입맛에맛는것 같더라고요.*^^*​6월 제철감자요리 감자잡채 어떠세요?​6월 제철감자요리 감자잡채​재료​감자 큰것 2개건 표고버섯 5개오이 1/2개당근 1/3개베이컨 110g소금 적당량, 후춧가루 적당량참기름 1/2숟가락, 통깨 약간포도씨유 or 식용유 적당량​(어른밥숟가락 계량입니다.)​​​건표고버섯 5개는 물에 충분히 담가 놓아주세요.전 다른곳에 쓰려고 좀더 담갔네요.​​감자는 조금 도톰하게 채썰어찬불에 5분 이하로 담궈준다.​​​표고버섯 담가 놓은 건 건져 갓부분을 떼어내고채썰어 주고오이 1/2개는 돌려깍기 해서 채썰어 준비당근 1/3개도 채썰어 준비해 줍니다.​​​베이컨 110g도 먹기좋게썰어 주고요.​​​끓는 물에 채썬 감자를 투명하게 익을 때까지2분정도 익혀준다.​​​체에 밭쳐 물기를 제거해 주고​​​달군팬에 기름을 두르고 데친 감자를 넣고소금 두꼬집과 후춧가루 약간을 넣어 골고루 익도록 볶아그릇에 덜어 준비해준다.​​감자 익힌 팬에 그대로기름을 두르고 오이에 소금과 후춧가루 약간을 넣어 살짝 익혀서 그릇에 담아둡니다.​​​표고버섯도 소금과 후춧가루 약간을 넣어 볶아준다.​​​당근도 소금약간과 후춧가루 약간을 넣어 볶아줍니다.​​​베이컨도 살짝 볶아주다가​​볶아 두었던 감자, 당근, 오이, 표고버섯을 모두 넣어볶아주면서 부족한 간을 소금으로 맞추어 줍니다.​​불을 끄고 참기름 1/2숟가락, 통깨 적당량을 넣어​​​잘 섞어주면 아삭한 식감이 일품인6월 제철감자요리 감자잡채 완성이요.*^^*​​​6월 제철감자요리 감자잡채 맛있는 제철반찬으로맛있게 먹을 수 있답니다.​​​아이반찬으로도 좋은 제철감자요리감자잡채 감자, 당근, 오이의 식감들이 아삭하고표고버섯의 식감은 쫀득하고맛있는 반찬으로 좋답니다.​베이컨 대신잡채용 소고기를 넣어주면 훨씬 잡채스러운 것이 맛있답니다.​​6월 제철감자요리요즘 감자가 참 맛있더라고요.​6월 제철감자요리로 추천드리는감자잡채​한번 만들어 드셔보세요.반찬으로 맛있게 먹을 수 있답니다.바로 해서 바로 먹으면 좋은 6월 제철감자요리감자잡채 아이들도 잘 먹어 주더라고요.*^^*​​​​6월 제철감자요리 감자잡채 만들어 드셔보세요.*^^*​​​​"
잡채,http://blog.naver.com/PostView.nhn?blogId=eueuy&logNo=221254482751,"다해먹는 요리학교다해요에서 이번에는윤식당 안부러운 잡채 레시피장어우엉잡채가 나왔네요그런데 !! 좀 특이한 잡채로당면이 1 도 안들어가는 잡채입니다얼마나 맛있게요 !장어가 들어가서 얼마나 몸에도 좋게요 !우엉은 손질을 해서 편으로 썰은다음채로 다시 한번 5 ~6 센티 썰어서 식초 1큰술 풀어 놓은 물에 넣어놔요 그냥 공기중에 두면 우엉은 갈변한다고 합니다버섯 부추 깻잎 당근 마늘 양파도채를 썰어서 준비를 합니다마트표 장어도 썰어주는데 크게 썰면장어만 다 줏어먹기 때문에 작게 썰어요팬에 식용유 붓고 렌지에 불을 올려요진간장 3 스푼 설탕 2 스푼 넣는데간장 3 대 설탕 2가 황금비율이라고 합니다맛술 반스푼 청주 반스푼 넣고물엿 한 스푼 넣고 물은 간장만큼3스푼 넣어요양념이 한소끔 끓어서 수분이 조금 날아가면물기를 쫙 빼놓은 우엉채를 넣고 졸여요이 양념장은 김밥속에 넣는 우엉 졸이는방법과 똑같다고 합니다불이 너무 세서 거품이 나면약불로 줄여서 졸여요유산지에 구멍을 뚫어서 덮으면수분 증발을 막아준데요이렇게 약간 국물이 남을 정도로타지않게 졸여줘야 한다고 합니다우엉은 따로 건져내고 남은 간장에표고버섯을 볶아줘야해요이렇게 만드는 만능간장은 모든 조림요리에다 잘 어울린다고 합니다 팬에 기름을 두르고 기름 양의 1/5 정도참기름을 두르고 팬을 달군다음마늘과 생강을 먼저 볶아요마늘과 생강을 볶다가 양파를 넣어서볶아내고 따로 담아낸 다음당근 홍고추, 청고추 순으로따로 따로 볶아내요수분이 많은 것부터 차례로 볶아낸다고 합니다양파+생강+마늘 -> 당근  -> 고추그다음 양념된 재료들표고 우엉 장어를 같이 넣고 조리를 해줘요장어를 맨 나중에 볶은 이유는장어의 비린 맛 을 채소 향으로 잡는다고 하네요이제 양파 당근 고추 볶아놓은 것들을차례로 넣고 부추와 깻잎을 넣은 다음에불을 끄고 잔열로 볶아주어요마지막 마무리로 참기름 한방울 넣어줘요당면을 넣지 않는 오로지 장어랑채소만 넣은 장어우엉잡채 !!일품요리로 딱 좋을 것 같은데요 ~~"
잡채,http://blog.naver.com/PostView.nhn?blogId=jdii00&logNo=221271854275,"갑자기 잡채가 먹고싶다는 신랑..집에 있는재료로 후다닥 만든 잡채소개해요~재  료당면---------1봉(4인분)부추-------------- 한줌당근-------------반개양파---------------1개표고버섯---------5개돼지고기---------100g간장------------4큰술설탕----------1/2큰술올리고당--------1/2큰술참기름------------ 3큰술통깨 2-------------큰술집에서 간단히? 해먹는 잡채라집에있는 야채종류 썼어요다행히 돼지고기가있었네요^^돼지고기가 없다면 어묵을 채썰어 넣어도맛있답니다~^^돼지고기는 간장2큰술,설탕반큰술, 후추 두번 톡톡 털어 넣고조물조물 해두었어요.다진 마늘도 넣어주면잡냄새 잡는데 좋지만마침 다진마늘이 똑떨어져서패스~ 했고요~ㅎ당면은 뜨거운물에5분 불러놓구요.기름살짝 두르고소금 톡톡 뿌려양파볶아주고요~당근도 소금톡톡뿌려서 달달 볶아줘요.기름은 조금만 넣고물을 살짝 넣어 볶아주면너무 기름지지않고 좋아요.표고버섯은물 세큰술 넣고간장 한큰술후추 톡~넣어줬어요.간이배어서 버섯을씹을때 좀더 맛있답니다.마지막으로 밑간해뒀던돼지고기 달달 볶아주면 끝~~~큰볼에 야채들 모아주고요~~(시금치 대신 사용한 부추도 살짝 볶아주면좋지만 신랑이생부추를 좋아해서 볶지 않았어요ㅎ )불려뒀던 당면을 팬에넣고간장3큰술 올리고당 반큰술넣고간이배도록 살짝 볶아줘요.간은 처음부터 다 넣지 마시구요조금씩 맛을보면서조절해주시면 되요~다 볶아졌으면불을끄고참기름과 통깨 넣어줘요~참기름 3큰술정도 넣었구요통깨 2큰술 넣었어요^^조물조물 볶아놓은 재료들과섞어주면 완성!!남은 잡채는 밥이랑 볶아서잘익은 김치 올려먹으면또다른 별미에요~냉장고에 남은 자투리 야채도 함께 넣어 볶으면더욱 좋답니다^^맛있는 저녁드세요~^^#잡채 #잡채만드는법 #잡채레시피"
잡채,http://blog.naver.com/PostView.nhn?blogId=zzzangel78&logNo=221283488839,파프리카가 냉장고에서 살려달래요~~~양념들은 미리 꺼내놓고고기 밑간부터 했어요.간장.다진마늘.설탕.참기름을입맛에 맞게 넣고 밑간해주세요.파프리카.피망.양파는 채썰고달군 팬에 기름을 두른후채소를 몽땅 넣고 빠른게 볶아쥐요.밑간한 고기도 따로 볶아주고당면은 끓는 물에 6~7분만 삶아주신후차가운물에 2~3회 씻어주세요.시금치는 잡채용이 아닌시금치나물을 하려고 손질해놨어요물기를 뺀 당면을 팬에 넣고 볶아주세요.당면에 간장과 설탕을 조금씩 추가해주면서각자 간을해주신후 볶은 채소를 넣고참기름.깨소금을 넣고 살짝버무려주심 됩니다!특히 깨소금은 아낌없이 투하!채소가 많지않아서 아이들이 좋아해요.ㅋ전 잡채만들때 시금치와 버섯은 안넣어요.축 늘어진 식감이 별로 안좋아서요.대신 파프리카는 살짝 볶아줌아삭하게 씹혀서 너무 좋아요!데친 시금치는 반찬용이네요.다진마늘.소금.참기름.깨소금...이조합이면 맛이 없을수가 없어요!
잡채,http://blog.naver.com/PostView.nhn?blogId=bb171942&logNo=221292555609,오늘은 우엉잡채를 맹글어 볼께요.냉장고에 우엉이 말라비트러져 있어서생각난 우엉잡채일단 우엉을 잡채처럼 얇게 채쓸어주시고당근도 그리고 목이버섯도채쓴 우엉은 볶아주실 껀데요.간장과 소금 그리고 후추 아주 조금넣고 볶아줍니다물에 약간불린 당면을 끓는물에 넣고삶아주는데 삶을때 다진마늘 함께 넣으시면깊은맛을 느낄수 있답니다.우엉잡채에 들어갈 고기는 간장.후추.소금.메실엑기스를 넣고 물어불려놓은 목이버섯고 기름을 살짝두른후 볶아주세요.준비된재료를 넓은 양푼으로 옮겨 담고섞어주시면 끝.따로 양념을 하지앓아도재료준비할때 조미료를 미리 넣어서 간만 잘 마추고 참기름과 깨소금만 뿌리면 우엉잡채 완성이요~~
잡채,http://blog.naver.com/PostView.nhn?blogId=icecream2052&logNo=221286519032,안녕하세요~파란하늘 아름다운 우리들의 하루 입니다. 오전엔 잔디와 화단에 있는 잡초들 뽑고요 힘들어서 쉬고 있네요~~오늘은 잡채 밥을 하자는 남편~~그래서 준비 합니다. 처음엔 우리 둘만 먹으려 했는데요. 그래서 재료를 작게 준비를 했는데~~친구분들이 오는 바람에 양이 부풀었어요~~양배추. 양파. 파. 풋고추. 붉은 피망. 파. 마늘. 요즘 우리는 시금치 사용을 잘 안해요. 삶으면 은근 질기더군요. 그래서 당면도 삶아 놨지요~~먼제 위의 야채들을 한꺼번에 다 넣고 볶아 줍니다. 양념은; 간장. 참기름. 후추가루. 요리당. 올리브 오일. 야채가루. 등으로 맛있고 칼칼하게 볶아주고요삶아놓은 당면을 넣고 볶아주면서 간을 한번 더 해줍니다. 맛있는 잡채~~칼킬한 잡채랍니다. 이렇게 그냥 드셔도 좋고요 밥하고 같이 드셔도 아주 좋아요~~이웃님들 좋은 하루 잘 보내시고요 행복 가득한 하루에 식사 꼭 챙기시길 바랍니다. ^_^
잡채,http://blog.naver.com/PostView.nhn?blogId=country_talker&logNo=221266844136,"현재시각: 4월30일 9시 35분집에 있다가 나왔다. 잡채에 넣을 고기 하나 더 살려고.. 어떤거 고르지~?금액대 별로 많네~~ 내가 보기엔 별 차이 없어 보이는데..내가 선택한건 행운의숫자 7이 들어간 고기~~!!울 엄마 깨끗하게 자연치료 되게 해주세영~ 제발~~ㅠㅠ집에 와서 피망을 식초 물에 깨끗하게 소독하며 씻는 중~~^^다른 야채 준비도 해야 겠다~~~내가 직접 길러서 말린 표고버섯!!!확실히~~ 표고버섯 넣은게 훨씬 맛있어..^^생수에 표고버섯 불려놓기~~!!하다보니 이번엔 참기름이 없어서 사러  나왔다..ㅠㅠ오늘 왜케 깜빡깜빡 하는지... 참기름 쎄일하네~~ 그래 너로~~!!!집에 가는 길에 보도블럭이 튀어 나왔네? 애들 다칠라나?120 전화해서 말해줘?  아니다. 귀찮다. 피망 자르는 중~~  당근 껍질 벗겨 써는 중~~ 칼 엄청 안드네ㅠㅠ 욕 나올것 같애.....-_-피망,당근 야채 2가지 준비 완료~~♡양파 손질중인데 껍질 버리기 아까워서 볶음밥 할때 넣어야 겠다~~ 헤헤^^양파 손질 중~~^^양파 써는데 눈 아퍼. 눈을 뜰수가 없엉ㅠㅠ중간에 창문열고 찬바람 쐬면서 잘랐다...아~~ 다신 안해ㅡ.ㅡ;;양파까지~!! 벌써~~ 3가지 완성^^이제 느타리 버섯 차례~~^^ 일루와~!!서로 떨어뜨려 놓고, 큰거는 찢어 발겨~^^물 끓여서 소금 살짝 넣고, 느타리버섯 데치기^^물 끓여서 소금 살짝 넣고, 시금치 데치기^^잠깐 넣었다빼는 정도. 너무 많이 데치면 흐믈흐믈 해져서 맛없쪙ㅠㅠ시금치~~ 시원하게 찬물 샤워 중~~!!표고버섯하고 당면뺀 나머지 재료 거의 다 준비 되어 가고 있다.뿌듯~~~!!난괜찮아~~ 난 괜찮아~~고기는~~ 간장,마늘,후추,매실청,참기름,소주에 재워놓는다..^^표고버섯도~ 너무 잘 불려졌넹~^^표고버섯이랑 느타리버섯을, 같은 버섯이니까 그냥 합쳐서 밑간했다. 참기름,후추,마늘,간장~시금치는 소금,참기름,마늘 넣고~~  쪼물딱쪼물딱!이제 볶기만 하면 된다~~ 헤헤^^양파 뽀꼬,버섯도 뽀까주고~~당근도 볶으기~~^^고기는 더 맛있게 볶아주자~~♡고기 넘 맛있쪙~~~♡그냥 이거 넣고 볶음밥해서 먹어도 너무 맛있을듯~~ 헤헤^^이제 정말 다 끝났엉~~당면만 삶으면 된다. 조금만 힘내자^^당면~!  개인적으로 왼쪽 당면이 더 맛있는것 같다.차이점을 말해주고 싶지만, 아직 정확하게 머라고 표현해야 할지는 잘 모르겠엉.하지만 확실한건, 먹으면 왼쪽께 훨씬 더 맛있다는 거...!!벌써 3시간째  이러고 있구낭 ㅠㅠ토닥토닥..^^꼬기 넘 맛있어서~~ 자꾸 집어 먹게 댕~~ 헤헤^^이제 마지막으로 당면 삶기! 한7~8분?당면을 좀 떼서 찬물에 씻어 먹어 보는게 제일 정확해ㅎㅎ당면 간하기~~~^^잡채를 볶을게 아니고 무칠거라서,다른재료에도 다 간을 했듯이.. 잡채에도 간을 따로 해준다.(간장,마늘,후추,참기름,깨소금,매실청)당면,고기,양파,당근,피망,느타리버섯,표고버섯,시금치20인분 잡채 준비 완료.볼 큰거에 재료 다 넣고 막~~ 섞어주기~~!!이때가 제일 좋아~^^ 행복함~~♡20인분 잡채 만들기 완성~~^^잡채는 막 무쳤을때가 제일 맛나~^^""잡채 황금레시피 만드는 법"" 완성~^^아~~ 맛있겠당~~~ 음~~~^^잡채 파티가 벌어졌넹~~~~♬양파가..... 모양이... 살짝 부끄럽당 ㅎㅎ눈이 너무 매워 가지고~~ 거의 눈감고 잘랐는데...저렇게까지...... ㅎㅎㅎ작은건 지금 내가 먹을 거~~!!큰거는~~ 내일 부모님 댁이랑, 넷째 언니네 가져다 줄거~~^^드디어 먹는 구나~~~^^오늘 밥 입맛 없었는데~~  맛있당~~^^"
잡채,http://blog.naver.com/PostView.nhn?blogId=jungfeho&logNo=221239179384,"잡채 황금레시피 인생레시피 꿀팁 포함규야가 너무 너무 좋아하는 잡채!황금레시피를 만나기 전엔 친정엄마가설명해주셔서 솔직히.. 잘못 만들겠더라구요ㅜㅜ그런데 이젠!잘하는요리 no.1 생생정보통 황금레시피 진짜..버릴게없네요.규야가 좋아하는 당면~식당에 가면 잡채가 허연게 있고 검은게 있고~잡채 황금레시피는 면에 양념을 쏙쏙 베이게하고불지않고~ 냉장고넣어놓고 다시 데워먹어도탱글한 식감이~ 최고!과정이 초간단 그런데 결과는 근사한생생정보통 황금레시피~ 따라해보겠습니다*제 요리과정?위주로 조금 수정했습니다*잡채 황금레시피재  료당면 250g(불리지 않아요)당근피망시금치양파당면 양념:진간장1/2컵, 올리고당 3/4컵. 오일4큰술참기름, 통깨돼지고기 밑간: 소금 조금, 마늘 1/3스푼*당면외 부재료는 기호껏 준비하심되요. 요즈음은 자른 당면도 팔더라구요.전 이마트 노브랜드 제품 쓴답니다.생생정보통  레시피 배운 이후로 엄청자주해먹거든요ㅋ 그리고..노브랜드꺼 맛나요.야채는 비슷한 굵기,길이로 기호껏 준비합니다.소금간 약간씩해서 볶아줄거에요. 시금치는 나물로 무쳐서 준비해 놓으면 되요.전 무쳐놓은 시금치나물이 있어서 냉장고에서꺼냈어요>.< 돼지고기 잡채용으로 대량 사놓으면 정말 편해요.두주먹 정도 되는거 같아요.잡내없애려고 소주 조금,마늘,소금 으로버물리고 밑간해놓았어요.그리고!생생정보통 황금레시피의 핵심 당면양념이에요.원래 레시피는 당면200g에간장1/2컵,올리고당1컵,오일(식용유)5스푼참기름 약간이에요. 이 정도..도 절대 짜지 않아요.그런데 저는 대량 만들어 몇번 나누어 먹으려니간이 점점 더 베이는거 같아서당면250g으로해서 양념 조절을 했는데싱거우면서도~ 간이 딱!맞더라구요.*잡채 황금레시피 만들어 볼게요*1. 색이 없는 양파부터 소금 약간 넣고 볶아주었어요.기름 조금 두르고 볶다가 기름이 모자르다 싶으면물을 조금씩 부어서 물로 볶아줘요.그래야 기름을 그나마 덜?! 섭취하게 된답니다.2. 당근도 소금 약간 넣고 볶아줘요.아삭한 정도까지요>.<3.피망은 소금 없이 볶아줬어요.역시 기름으로 볶다가 물을 약간 부어물로 볶아줬어요.4.돼지고기도 달달달 볶아줬어요.오동통~ 하게 익으니 더 맛나게 보이네요양파.피망.당근.시금치.돼지고기 부재료 완성!5.끓는물에 당면을 11분 삶아줍니다.당면을 따로 불릴 필요없어요.끓는물에 삶고 양념에 익히기 때문에불리는 과정 없어도 쫄깃,부드럽게 익는답니다.6.11분 삶은 잡채 황금레시피 당면을 차가운 물로 씻어냅니다. 면이 탱글해져요.어떤 레시피는 여기에 오일을 둘러서서로 붙지 않게 하던데.. 굳이 오일 두르지 않아도양념을 먹이는?과정이 있기 때문에 붙지 않는답니다.(오일만 더 먹어요ㅡ.ㅡ) 7.황금레시피 잡채 양념을 궁중팬에 넣고한소큼 끓여줍니다.8.양념이 끐기 시작하면 당면 바로 투하!중불로 졸여주세요.투명한 당면에 양념을 스며들게 하는거에요.생생정보통 황금레시피는 4~5분 정도라고하는데제가 해본 결과...양념이 전부 당면에 스며 들때까지 졸이면되요. 9.졸여낸 당면을 부재료들 위에 투척~한김 날리고 참기름 2~3스푼정도 골고로 뿌려주세요.통깨 솔솔 뿌리고 마무리잡채 황금레시피~ 어마어마한 색감을 자랑하며완성 끝~♡11분 삶고 7~8분정도 양념에 졸이며짭쪼름하고 달달한 양념이 쏙쏙 베었어요.간장양이 많아서 처음 레시피를 접했을때깜짝!놀랐는데 당면에 양념을 졸이니겉돌지 않고 속까지 베여서 간이 딱!맞아요.친정엄마도 제 잡채 드셔보시고 맛있다고 해주셨지요.특별한 날 풍성한 비주얼과 실패없는 맛을 보장~그리고 즐겨 먹어도 질리지 않는 잡채♡ 오늘도 저녁 메뉴입니다"
잡채,http://blog.naver.com/PostView.nhn?blogId=rain0fmoon&logNo=221284325534,자세한 요리과정은 유튜브를 확인해주세요.유튜브를 구독하시면 더 많은 영상을 바로바로 확인 하실 수 있어요.↓↓↓YOUTUBE안타레스 키친 (Antares Kitchen)
잡채,http://blog.naver.com/PostView.nhn?blogId=yjy2292&logNo=221292951321,"요즘 핫한진짜쫄면코스트코 잡채볶음밥달달한 맥주 템트휴일 늦은 점심 간단한 한끼 참 좋네요추천얼마전 방문했던 코스트코그중 제일 먼저 골랐던 제품잡채볶음밥그외 우리가 구매한 목록, 할인가격여기서 참고하세요^^코스트코 한우물 잡채볶음밥 11,790늘 곤드레밥만 사랑하는 우리에게새로운 맛난 밥을 추천받아서 바로 구매늘 맛나지만 손이 많이 가서쉽게 하기 망설여지는 요리진짜 쉽게 간단히 조리하도록 만들어서더 좋네요조리법은프라이팬에 4분 볶거나전자렌지에 4분만 조리해서맛있게 먹기1봉지 300g7개 들어있어요한봉지로 아기들 둘 나눠서 먹음 딱 좋은넉넉한 양아기들의 낮잠이 길어져잠에서 일어나 배고프다는 아이들과정해놓은 맛집은 포기아기가 배고프다는 말에바로 조리해서 챙겨줄 수 있으니 더 좋구^^진짜 전투적으로 잘먹는 베베코스트코 잡채볶음밥참 괜찮네요그리고 이영자라면으로요즘 핫한 라면진짜쫄면친구들이 라면 치곤 맛있다고여름에 간단 한끼 좋대서추천받아 구매해본 진짜쫄면비빔라면과 같은 조리법물에 건조 스프 넣고 4분간 끓이기양념스프양도 상당히 많아서매운걸 못먹는 저희부부진짜쫄면 2개 끓여서 스프는 1개만..그래도 양념이 넉넉할만큼 양념스프양이 많아요그리고 그래도 맵네요휴~매운걸 못먹는 사람은 비추열무김치 올리니 딱 좋네요진짜쫄면과코스트코 한우물 잡채볶음밥템트맥주게으르고픈 휴일 간단한 한끼로편하고 맛있네요재구매 의사 둘다"
잡채,http://blog.naver.com/PostView.nhn?blogId=dream7842&logNo=221253413586,"시금치, 당근, 파, 느타리버섯, 양파, 목이버섯을 넣어 만든 잡채에요백종원잡채 하는 것을 보면서 맛있겠다 생각했는데 저는 그냥 제 마음대로 만들었어요오래전부터 써오던 진표 당면이에요진표당면을 써 온건 아주 오래 전 부터였어요아주 오래 전 에는 진표당면이 재래시장 에서만 팔았었거든요언제부턴지 슈퍼에서 팔기 시작 하더라구요진표당면 쫄깃하니 참 좋아서 전 진표만 고집해요~야채를 볶아서 잡채를 무칠 큰 그릇에 넣었어요시금치는 삶아 참기름과 소금으로 무쳤고당근, 양파, 목이버섯, 파는 기름에 볶다가 소금만 조금씩 넣었어요백종원잡채는 굉장히 간단하게 하던데다음엔 따라해야징..진표당면이 아닌 다른 당면으로 하면 괜히 마음이 불안 하드라구요오랫동안 써온 고집 탓 일거라 생각돼요..당면은 열량이 높은 편에 속해 포만감이 높아 식사 대신에 먹기 좋다고 합니다소화가 용이해서 위에 남아있는 시간이 짧아 부담감이 없고 당질이 풍부해 각종 비타민이 풍부한 채소와 먹으면 궁합이 좋기 때문에 고기와 각종 채소가 더해진 잡채는훌륭한 조합이라고 할 수 있다고 합니다야채를 후라이팬 에서 볶아 큰 그릇에 놓았더니 김이 나네요맛있게 무쳐져야 할테데 잘 무쳐지려나~?당면을 물에 불리지 않고 끓는물에 그냥 삶았어요물에 불린것보다 좀 오래 삶아야겠지요당면을 삶을때 참기름과 진 간장을 넣고 삶았어요참기름을 넣으면 빨리 불지않고 진 간장은 색깔이 들어가검은색깔을 내어 먹음직 스럽게 보이드라구요당면을 만드는 주재료는 고구마전분과 옥수수전분 으로 혼합하여 만들기 때문에불투명의 백색 반점이 많은 것을 볼 수 있습니다고구마전분 에는 마그네슘이 포함되어 혈관 확장 효과를 통해 혈압을 낮춰주고 혈중 콜레스테롤을 내리는 효능이 있다고 합니다당면을 물에다 삶아서 헹구지 않고 그냥 체 에 받쳐 물기를 뺐어요알맞은 길이로 잘랐어요저희집은 잡채 긴것을 좋아해서 길게 잘랐어요잡채는 좀 길어야 보기에도 예쁜것 같아요백종원잡채 레시피와 상관없이 내맘대로 했는데다음엔 백종원잡채를 참고 해야겠어요진 간장과 설탕을 넣고 간을 맟춰 무쳤어요진 간장으로 간을 맞추고 참기름이 넣었어요참기름은 듬뿍 아주 듬뿍 넣었어요고기를 넣지 않은 대신 참기름을 많이 넣었답니다깨가 많이 들어간것 같은데 많이 넣은게 아녜요전체적으로 무칠때 깨를 쪼금만 넣었거든요잡채가 다 만들어 그릇에 담고 위에다 뿌려 많이 넣은것처럼 보이는 거에요백종원잡채 같이 맛있게 만들고 싶었던 집 잡채가정말 맛있게 잘 만들어 졌네요 ♬"
