잡채,http://blog.naver.com/PostView.nhn?blogId=ssl2507&logNo=221296118471,#신천시장깐땅 #고추잡채 깔끔상큼한걸요~^^요즘 맨날맨날 중식탐방에 입이 즐거운 시간입니다요. ㅎ신천댁이 오늘 메뉴는 고추잡채로~ 비가 와요~ 급 비가쏟아지는 여름인지 봄인지 변덕쟁이 대구날씨네용신천시장깐탕 깔끔상큼 고추잡채요~~~한젓가락 하실래요?가격 1.2 완전저렴이...고추잡채야채듬뿍 아삭개운한맛 추천추천요함께해서 좋은 요거요거 일잔~ㅎㅎ 오늘 피로 한방에 날려버렸다는거...좋네요.촉촉히 비 내리는날 맛있게 먹었어요.#신천시장  #깐탕 #신천깐탕 #범어동깐탕 #수성구깐탕
잡채,http://blog.naver.com/PostView.nhn?blogId=asin90416&logNo=221211870428,"9월에 우리가 함께 떠난 여행지는 바로 중국이였어요!중국의 식문화를 알아보며 대표적인 음식들 그리고 중국의 다양한 식재료들도 함께살펴보았답니다.신나게 요리했던 청라 키즈쿠킹 버디쿡의 중국 요리여행 사진들 올려봅니다.자, 먼저 고추잡채에 들어가는 돼지고기를 밑간 해줍니다~비닐장갑 야무지게 착용하고 밑간 양념을 !!조물조물 손에 느껴지는 돼지고기 촉감을 아이들은 부드럽다~미끄럽다~말랑하다~정말 다양하게 표현을 해줍니다.고기에 양념이 잘 베일 수 있도록 밑간을 해준 뒤중국 고추잡채에 들어가는 야채들을 칼질하여 준비해야하죠~청라 키즈쿠킹 버디쿡에서 처음 만난 죽순이 아이들은 신기한지 호기심 가~득한 눈빛으로 탐색합니다. 색깔이 다양한 파프리카도 아주 예쁘게 썰어주며고추잡채에 알록달록 색깔을 입혀주는 버디쿡 친구들~죽순~당근~버섯하며 다양한 식재료 탐색이 활발하게 이뤄졌던고추잡채 수업이였어요!모양 찍기 놀이는 아이들이 싫어하는 야채와 친해질 수 있는 방법 중 하나!!고추잡채에 꽃당근을 아주 귀엽게 찍어내는 친구들~물론 당근을 미리 데쳐 준비해야해요!아이들이 찍기틀로 잘 찍어낼 수 있도록 말이죠^^빨주노초~색깔도 너무 예쁜 청라 키즈쿠킹 버디쿡의 고추잡채!고추과에 속하는 피망과 그의 친구 파프리카까지 아주 잘 썰어줬지요~모든 재료의 손질이 끝났네요!!이제는 맛있는 냄새 솔솔 풍기며 먹음직스럽게 야채를 볶아줘야 합니다.버디쿡 특제 고추기름으로 츠와아아아~~~~소리와 함께 맛을 더해줄 굴소스도 넣어 선생님과 함께 고추잡채를 요리해주는 꼬마요리사들고추잡채 냄새가 너무 좋다며 얼른 시식하기를 원했답니다.볶는 요리까지 모두 끝난 요리사들은 키즈존에서 친구들과중국 전통의상을 디자인해보는 시간을 가졌답니다.아이들이 연계활동을 하는 동안 선생님은 고추잡채와 함께 시식할 꽃빵을 준비했습니다^^알록달록 중국의상을 예쁘게도 꾸며주는 친구들다양하게 옷도 입혀주고 서로 인형놀이도 하며 즐거워 하는 모습이에요.중국 국기까지 만들어 포장지에 붙여주면~!그 안에 우리가 만든 고추잡채를 예쁘게 담아봅니다.""이거 짜장면 먹으러가서 먹어봤어요~!!!!!""아이들이 아는척을 해주니 아주 기쁘군요~:-)고추잡채에 꽃빵이 빠지면 안되지요!폭신폭신한 꽃빵도 고추잡채와 함께 포장합니다~아이들 손은 참 생각보다 야무져요~음식도 그냥 담는게  아니고  어떻게 담아야 보기 좋을까~뚜껑을 열었을 때 어떤 모습이면 더 좋을까~선생님과 친구들과 이야기하며 담는 모습!작은손으로 꽃빵도 담고 깨도 솔솔 뿌려 아주 먹음직스러운청라 키즈쿠킹 버디쿡의 고추잡채를 포장해줍니다.이 시간을 기다렸다!!!우리가 만든 요리를 다함께 맛보는 시간!어때 어때? ㅎㅎㅎㅎㅎ모두 엄지척을 올려줍니다.꽃빵은 부드럽고~부드러운 꽃빵 안에는 직접 만든 고추잡채가 고기와 함께 씹히는 식감이 아~주 맛이 좋죠.중국으로 요리여행 떠난 우리 버디쿡 귀요미들~고추잡채 제목도 써주고 포장 완료 해주십니다.버디쿡에서 요리여행을 떠나며 다양한 나라의 요리를 접해보고그들의 식문화도 살펴보는 버디쿡  세계요리여행 수업입니다.우리 아이들이 더 다양한 식재료와 음식을 접해볼 수 있도록앞으로 더 멀~리 여행을 떠나봐야 겠는걸요^?^ 부모님들께서도 너무나 맛있어해주신 청라 키즈쿠킹 버디쿡의 고추잡채 수업도성공적으로 마무리 되었습니다! 버디쿡 사진 절대 불펌모든 사진은 버디쿡의 소중한 자산입니다."
잡채,http://blog.naver.com/PostView.nhn?blogId=onhumom&logNo=221200886682,"윤 식당에서 베지테리언 야채 잡채를 보고 고기가 없어도 잡채가 맛있을까?고민하다가 베지테리언 요리 야채 잡채 만들기 해보았습니다.베지테리언 요리 야채 잡채의 장점은 크게 두 가지인데요.하나는 재료비가 적게 든다는 점!또 하나는 음식이 식어도 느끼해지지 않는다는 점입니다.기존 잡채와 달리 고기가 없어서 서운할 수도 있겠지만, 담백하고 아삭한 식감이 살아있는, 깔끔한 야채 잡채 권해 봅니다.냉장고 속 야채 고기 와 비슷한 식감의 유부당면 잡채 당면 밑간  - 간장 1/2컵, 설탕 1/3컵, 참기름 3 큰 술야채볶음 양념 - 맛소금, 후춧가루, 다진 마늘 1/2 큰 술, 굴 소스 1/2 큰 술마무리 양념  - 깨소금, 참기름계량 도구 - 어른용 밥숟가락, 작은 물컵베지테리언 요리 야채 잡채 만들기에서 가장 먼저 할 일은 잡채 불리기입니다. 깜빡 잊어버려서 야채 등의 재료 준비가 다 끝나서 시간이 부족하다면 따듯한 물에 불리고, 시간이 충분하다면 찬물에 불리면 됩니다.그래도 잊어버리면 좀 더 길게 삶으면 되니까 걱정할 필요 없습니다^^시금치는 뿌리 부분을 잘라 내고 물이 끓으면 굵은소금을 넣고 살짝 데쳐 줍니다.아삭한 식감이 좋다면, 초록색이 진해 지면 불을 꺼줍니다.원하는 식감이 아니라면 나중에 다른 재료와 한 번 더 볶아 줍니다.최대한 30초는 넘기지 않습니다.삶아낸 시금치를 흙이 나오지 않을 때까지 헹군 뒤 물기를 꼭 짜고, 다진 마늘, 참기름, 깨소금을 넣고 밑간해 둡니다. 유부는 두부를 튀긴 것인데요.정확히 고기 와 일치하는 식감은 아니지만, 야채보다는 좀 더 질긴 식감을 가지고 있습니다. 간장과 설탕을 1 : 1/2 비율로 밑간해 둡니다.밑간 한 유부 와 시금치, 채 썬 당근과 파프리카 재료 준비가 끝났습니다.불려둔 당면을 삶아 줄 차례입니다.끓는 물에 체에 밭쳐 물기를 제거한 당면을 넣어 삶습니다.얼마나 익어야 할지 모르겠다면, 찬물을 담은 컵에 당면을 수시로 넣어 봅니다.딱딱하지 않고 부드럽게 말려지면 다 삶아진 것입니다.삶은 당면은 체에 밭쳐서 물기를 제거합니다.좀 더 찰진 면이 좋다면 찬물로 한 번 헹궈 주는데요, 부드러운 식감이 좋다면 물기만 빼줍니다.잡채용 당면은 반드시 밑간을 해두는 것을 권합니다.야채는 볶으면서 소금 간을 하는데, 당면은 밋밋한 채로 둔다면 양념이 겉도는 느낌이 됩니다.베지테리언 요리 야채 잡채 의 야채를 볶아 줄 때 후춧가루와 맛소금으로 밑간을 합니다.양은 아주 적습니다.보통 한 꼬집이라고 말하는 정도입니다.이렇게 넣을 걸 뭐 하러 넣나? 싶은 생각이 들 정도로만 넣어 줍니다.야채를 볶는 순서는 도마에서 사라진 것처럼 단단한 재료부터 볶아 줍니다.시금치를 먹어 보고 식감이 취향에 맞는다면 마무리 단계에서 넣어 줍니다.야채는 색이 변하면 다음 야채를 넣는 식으로 볶아 줍니다.유부는 밑간을 해 두었으니까 당근과 파프리카만 소금, 후추 양념을 해줍니다.야채를 다 볶으면 불을 끄고, 밑간해둔 당면과 참기름, 깨소금을 넣고 잘 섞어 줍니다.시금치도 넣어 준 뒤에 불을 켜고 데운다 생각하고 살짝 볶아 줍니다.이미 다 익은 재료이기 때문에 오래 볶을 필요는 없습니다.아삭한 식감이 특징인 베지테리언 요리 야채 잡채 완성입니다.베지테리언 요리라서 계란지단도 생략했는데요.계란지단을 얹어 주면 좀 더 보기 좋은 잡채가 완성됩니다.냉장고에 야채만 있을 때도 맛있는 잡채를 만들 수 있답니다.베지테리언 요리 야채 요리를 만들고 싶으신 분들께 도움이 되기를 바래봅니다."
잡채,http://blog.naver.com/PostView.nhn?blogId=creamy0080&logNo=221253006420,생일에 빠질 수 없는 메뉴가 미역구과 잡채 아닐까싶어요. 특히 시어머니생신상 차리시는 분들 많으신데  여간 신경쓰이는게 아니죠. 그래서 손쉽게 조리하고 더불어 맛까지 최고인프레시지 쿠킹박스 소고기버섯잡채를 소개합니다!!!2인분용량인데요. 딱 봐도 포장이 예술이요. 아이스박스에 도착했구요. 깔끔하게 배송되어 만족!맨 아랫부분에는 레시피가 들어있어서조리할 곳에 붙여놓으시면 좀 더 수월하게 조리할 수 있어요!포장상태 보실까요!소스 하나하나 재료 하나하나 개별포장되어있고재료들이 무르거나 한것 없이 깨끗하게 도착했찌요. 시어머니생신상 생각만해도 손떨리는데..ㅎㅎ이렇게 깔끔하게 딱 분량만큼 개별포장되니 저처럼 곰손도 빠르고 쉽게 또 맛있게 할 수 있찌요!!!레시피대로 먼저 당면을 8분간 끓여주었어요. 소고기에는 소금과 후추로 밑간을 합니다. 재료 한개씩 밀봉되어있는 것을 잘라서 후라이팬에 기름을 두르고 2분간 볶아주었어요.8분간 끓여서 채에 받혀두었떤 당면을 넣고개별포장되어있는 소스를 2/3 넣어주는데요. 다 넣지마시고 2/3만 넣은 후 간을 맞춰서 더 넣으라고 써있더라고요. 저는 다 넣었어요. ㅋㅋㅋ잡채 사실 손이 참 많이 간다고 생각했떤 시어머니생신상 인데요. 프레시지 쿠킹박스와 함께하니 이저 진짜 10분에거의 다 완성!!!이제 1분만 지나면 진짜 완성이네요. ㅎ마지막으로 동봉된 참기를을 뿌려 마무리 합니다. 진짜 12분정도면 잡채 레시피 완성!!시어머니생신상 준비하려면 사실 음식 여러개를 준비해야해서금손이 아닌 저는 참 걱정도 많았는데이제는 쿠킹박스 프레시지 있으니까 걱정이 없네요. 4~5개의 음식도 1시간 최대 2시간안에 모두 마무리 하고 셋팅까지도 할 수 있을 것 가타요. 가성비 완전 최고에요!어려운 손님요리 시어머니생신상 집들이음식 등 힘들고 어려운 상황에서나에게 큰~~~ 도움을 줄 쿠킹박스 프레시지완전 강추합니다!
잡채,http://blog.naver.com/PostView.nhn?blogId=zigzag1031&logNo=221282141511,"잡채는 왜 잔칫날하는지알겠더라구요ㅋㅋㅋ일 엄청 많았네요ㅋㅋ사건의 전말은!!롯데마트에서 파프리카가 1개 천원하길래~이건 무조건 사야한다고 2개사고~시금치도 한단에 천원하길래 냉큼샀다지요!그래서 하게된 잡채ㅋㅋ잘됐다며 우리신랑 잡채킬러인데 이번기회에 요리실력 보여주려고했다지요^^그런데하다보니 왜케 일이커집니까ㅋㅋ양도 많아서 친정부모님께 첨으로 잡채한통갖다드려봤네요^^일단 재료준비!!당근 반개, 양파 반개, 시금치 반단색별로 파프리카 반개씩, 잡채용 돼지고기진간장, 참기름, 깨소금, 꽃소금, 후추당면25인분짜리로 만든건 첨이에요ㅋㅋ먼저 재료손질!당근, 파프리카를 손질해놓고!시금치도 삶아서 참기름과 소금으로 간해놓고돼지고기도 소금간해서 볶고야채들도 따로따로 다 볶았어요!마지막으로 당면을 삶고~삶은당면은 체에 건져 찬물에 헹군후간장과 설탕으로 살짝 볶았어요~대접에 부어 비닐장갑끼고 참기름넣고 조물조물^^비빔밥같아보이지만 엄청나게 많고맛있는 잡채가되었어요ㅋㅋ비쥬얼좋쵸??^^군침도시나요~~??ㅎㅎㅎ퇴근후 집억 온 신랑~ 맛있다며 촵촵먹어주네요^^우리딸도 엄마최고를 외치며 맛있다고 당면만먹었어요ㅋㅋㅋ(너 웃기다~ 같이먹어야하는거거든??ㅋㅋ)친정에도 갖다주고 뿌듯한 하루가됐어요^^오늘 저녁엔 뭐해먹지!?? ㅋㅋ#오늘메뉴 #잡채 #저녁메뉴 #잔칫날"
잡채,http://blog.naver.com/PostView.nhn?blogId=ilsanwoman75&logNo=221273069295,"맛있는 잡채 만드는법생일이나 명절날 되면 잡채를 만들어야 명절분위기 난다고 하는 우리 가족들~특히 우리 어머님이 제가 만든 잡채를 제일 좋아하시거든요.재료가 다 없어도 맛있는 잡채 뚝딱!잡채 만드는법 가르쳐드릴께요.재료준비 : 당면, 시금치, 당근, 양파, 버섯, 잡채거리 소고기 1. 당근과 양파는 채 썰어 기름 두른 후라이팬에 소금 간을 하면서 볶아 놓는다.2. 시금치는 데쳐서 소금, 참기름, 깨소금을 넣어 무쳐 놓는다.3. 시금치를 데친 후 바로 버섯을 데친 후 찢어서 간장양념으로 후라이팬에 볶아 놓는다.4. 잡채거리 소고기를 불고기 양념을 해서 재워 놓은 뒤 볶아 놓는다.5. 당면은 삶아 찬물에 씻어 물기를 뺀다.6.  후라이팬에 간장, 물, 설탕을 넣어 섞은 뒤 물기 뺀 당면을 넣고 볶아 놓는다.   ( 이렇게 볶아 놓으면 당면이 나중에 불지 않고 색도 예쁘게 나면서 간이 베어 맛이 있다.)7. 모두 합쳐 간장, 물엿, 참기름을 넣어 섞어준다. 8. 간을 보며 양을 조절한다.맛있는 잡채 만드는법 쉽죠!명절 때가 아니더라도 반찬 없는 날 잡채 해주면 밥이랑 쓱쓱싹싹 맛있게 먹을 수 있는 단품요리에요.전 친정엄마 생신이라 준비한 잡채!부족한 상차림이지만 집에서 맛있는 식사 했답니다."
잡채,http://blog.naver.com/PostView.nhn?blogId=kh_kmj9562&logNo=221210861747,"​​​​​​한식, 김치 잡채 볶음밥재료 양은 자세히 쓸 예정이지만 쓰지 않는 경우도 있으며,재료 양, 불 세기, 양념 계량,개인 입맛에 따라 만족도가 다를 수 있습니다.이 점을 참고 부탁드립니다.명절 즐겁게 보내셨나요?명절이 끝나면 가족과의 짧은 만남 탓에 아쉬움도 남지만,많은 음식도 남죠. 처음에야 맛있게 먹겠지만,시간이 지나면 느끼한 음식보단 얼큰한 음식이 땡기고,그래도 남은 음식은 해결해야겠고,어찌해야 될까 걱정하며 이런저런 해결법을 찾는데.잡채는 조금이라도 매콤하게 먹고 싶은 마음에김치 잡채 볶음밥으로 즐겨보았습니다! 재료​파 한 대,김치 반 포기, 식용유,잡채 남은 양 다 사용했습니다. ​백종원 선생님께서 '파기름'을 알려주신 이후,저도 볶음밥 만들 때마다 파기름을 만들어 먹네요!사실 파기름을 만든 것과 안 만든 것의 차이는 모르겠지만,(실험을 안 해봤습니다.)파기름 낸 후에 볶음밥을 해 먹으면 확실히 맛있어서 귀찮아도 꼭꼭 해 먹네요!달궈진 팬에 식용유를 붓고, 파를 넣고 볶아주시면 됩니다! 전 약한 불에 볶았는데. 다른 분들은 어떻게 하실지 모르겠네요.전 습관이 돼서 어섯썰기로 잘랐는데.백종원 선생님께선 다른 방식으로 잘라서 저도 뒤늦게 아차 싶었네요. ​전 요리 초보여서 파기름을 잘 모르겠더라구요.식용유 붓고 파 달달 볶다가 파 익은 냄새가 나거나, 파가 약간 탈 거 같으면 김치를 넣고 볶아줍니다. 그렇게 볶다가 김치가 어느 정도 풀이 죽으면​잡채를 넣고 볶아주었습니다!잡채와 김치를 같이 볶으니 다른 양념이 없어도붉은 양념이 돼서 맛있어 보이네요!마미께서 주신 잡채'만'해도 둘이 먹기 배부른 양인데 김치와 이것저것 하니 이미 큰 웍이 반이 꽉 찼네요. 볶음밥이나 비빔밥의 경우 부재료가 들어가기에밥을 평소보다 덜 넣으셔야 되는데.잡채는..잡채만 해도 배부른 재료이기에밥 양을 평소보다 적게 해주세요!블로거'제인'님께서 싱거우면 김치 국물이나 굴 소스를 살짝 넣으라고 하셨는데.전 참기름 조금과 볶음밥 = 굴소스여서 굴소스 살짝 넣었네요.굴소스는 볶음밥 만들 때 필수인 듯! ​  완성됐네요!취향에 따라 반숙 후라이나 김가루를 추가하신 후 드시면 됩니다!전 반숙 후라이 하려다가 귀찮아서 김가루만!잡채가 막 만들 때 먹으면 맛있는 음식이지만,시간이 지나서 먹으면 어떤 방식으로 데워먹어도 아쉬운데.이렇게 먹으니 정말 맛있더라구요!일단 잡채 특유의 식감도 나쁘지 않았고,김치 덕분에 잡채 특유의 느끼한 맛이 없습니다! 게다가 잡채에 이미 오뎅, 버섯, 시금치, 당근 등다양한 재료가 들어있어서 아쉬움이 없고,식감도 만족스럽고 이래저래 좋았습니다!느끼한 명절 음식에 지치신 분,남은 잡채를 다르게 드시고 싶으신 분들께 추천해드립니다! 제가 참고한 블로그입니다!이 자리를 빌려 좋은 정보를 주신 제인님께 감사드립니다! https://blog.naver.com/0813dcba/220626252351 "
잡채,http://blog.naver.com/PostView.nhn?blogId=cookie1411&logNo=221239549732,"언제 먹어도 맛있는 잡채얼마 전 끝난 윤 식당 때문에 집에서 잡채 만들어드신 분들 많으셨죠? 저 역시 볼 때마다 침이 꼴깍꼴깍 넘어갔는데 윤식당에서는 특제 마더 소스로 잡채를 만들었다면 저는 그냥 집에 있는 재료로 잡채를 만들어봤어요. 집에 있는 야채와  묵말랭이, 고기 등을 이용해서 당면보다는 야채가 많은 편이니취향에 맞게 조절해서 조리하시면 좋을듯합니다.재료시금치 1단표고버섯 6개당근 1개 양파 1개 잡채용 안심 돼지고기 300g (간장2큰술+ 미림1큰술+설탕1티스푼)묵 말랭이 2줌 달걀 3개 당면  300g양념간장 4큰술설탕  1큰술다진마늘 1큰술참기름 2큰술통깨 식용유깨끗이 다듬은 시금치는 끓는 물에 소금 1큰술을 넣고 재빨리 데쳐 찬물에  헹궈 준비합니다.표고버섯은 기둥과 갓 부분을 분리해 기둥은 새로로 찢고갓 부분은 얇게 썰어줍니다.당근과 양파 역시 가늘게 채 썰어 준비해주시고 저는 말려놓은 도토리 묵이 있어서 미리 물에 30분 정도 불려 준비했어요. 잡채용 돼지고기는 간장 2큰술 , 미림1큰술 , 설탕 반 큰술, 후추 약간을 넣고 버무려 잠시 재워주세요.달걀은 흰자와 노른자를 분리 흰자에는 녹말 1티스푼을 넣고 잘 섞어주시고 흰자 노른자 각각 체에 걸러 기름 살짝 두른 팬에 약불로 얇게 지단을 붙여 준비합니다.흰자에 녹말을 넣는 이유는 녹말이 들어가면 흰자가 잘 찢어지지 않아요.당면은 미리 30분 정도 물에 불려 준비합니다.불려 놓은 당면은 끓는 물에 간장 2큰술을 넣고 약 6분 정도 삶아주세요.시금치는 먹기 좋은 크기로 썰어 참기름 1큰술, 소금 약간 버무려 준비합니다. 달군 팬에 식용유를 소량 두르고 재워놓은 고기를 볶아주세요.채 썬 당근과 양파도 숨이 너무 죽지 않도록 각각 볶아 줍니다.불려준 묵 말랭이와 버섯도 볶아주세요.삶은 당면은 찬물에 헹구지 말고  참기름 2큰술에 버무려주시면 불지 않고 덩어리지지 않아요. 각각 준비한 재료들 여기까지 야채를 다듬고 채 썰고 각각 볶아줘야 해서 손이 많이 갔지만  이젠 버무리기만 하면 끝이에요. 당면에 볶아놓은 모든 재료를 넣고 참기름, 간장, 설탕, 다진 마늘을 넣고 버무려주세요.마지막은 통깨로 마무리 달걀지단은 같이 넣고 버무려 주셔도 되고 먹기 직전에 고명으로 올려주시면 좀 더 센스 있어 보여요. 잡채 완성  재료 손질에 손은 많이 갔지만손 많이 간만큼 맛은 보장 손님 초대용으로 좀 더 색감에 신경 쓰신다면 빨강색 파프리카가 들어가면 더 예쁠듯합니다.오랜만에 먹어서 더 맛있었던 잡채 묵 말랭이를 넣어서인지 쫀득거리는 식감도 좋고내 입맛대로 냉장고 속 재료 활용해서 만들어드셔보세요."
잡채,http://blog.naver.com/PostView.nhn?blogId=blossomj0905&logNo=221259819549,"구워먹는 고기라면 다 좋아하는 나!양도 양고기 스테이크, 양갈비, 양꼬치 가리지 않고 좋아하는데 양꼬치를 안먹어 본 친구가 있어 맛있는 양고기 세계에 입문시키고자 ㅋㅋㅋ 친구와 함께 왕십리 해성양꼬치에 다녀왔다.원래 한양대 앞 먹자골목이 좀 복잡하긴 한데1. 왕십리역에서 온다면 세븐일레븐(새마을 금고 옆)에서 삼구포차쪽으로 쭉 걸어들어오면 되고2. 한양대 역에서 온다면 룩옵티컬 골목으로 들어와서 마장갈비가 보이는 곳에서 좌회전 하면 된다.#왕십리양꼬치 #해성양꼬치 #왕십리맛집넓고 쾌적한 해성 양꼬치 내부.토요일 오후 5시에 방문했는데 좀 이른 저녁시간이라 한산했지만 점차 사람들이 늘어났다. 이렇게 골목에 있는데 어떻게 알고 오는건지, 나만 몰랐던 한양대맛집 해성양꼬치!#한양대양꼬치 #한양대맛집해성양꼬치 메뉴! 우리는 같이 간 친구가 양꼬치 입문자이기에 무한리필은 입에 안맞을 수 있을 것 같아 양꼬치 30개와 사장님 추천으로 고추잡채를 주문했다.쨔잔- 양꼬치 30개! 매운 맛과 카레 맛을 골고루 섞인 양꼬치들! 꼭 무한리필이 아니라 낱개로 주문가능한데 해성양꼬치는 양꼬치가 개당 1000원이라 가격도 매우매우 저렴한편이다.뱅글뱅글 돌아가며 구워지는 양꼬치.다익은 양꼬치는 꼬치에서 빼내서 쯔란에 콕콕 찍어먹으면 된다.양꼬치 잘 못 먹으면 냄새나구 그러는데 해성양꼬치는 냄새없이 고기도 부드럽고 맛있었다! 무엇보다 양고기 입문자인 친구가 거부감없이 맛있게 먹어줘서 입문시킨 입장에서 매우 뿌듯뿌듯ㅋㅋㅋㅋㅋ사장님 추천 메뉴인 고추잡채도 등장! 고추잡채는 꽃빵과 함께 먹어야 제맛이징.여자 둘이서 고추잡채에 양꼬치 30개 순삭하고 왔다. 하하하하하하나와 친구가 잘 먹기도 하지만 해성양꼬치가 요리와 양꼬치 모두가 맛있어서 다 먹을 수 밖에 없었음.지난 토요일의 저녁상 사진으로 포스팅 끝.무한리필이 아니더라도 저렴하게 양꼬치가 먹고 싶을 때 해성 양꼬치 적극 추천!!!!"
